{
  "brief_hash": "9885d9d1",
  "iteration": "003",
  "stage": "refine",
  "content": "// ===== FILE: bollinger_leg_trigger.feature =====\nFeature: BTCUSDT 15분 닫힌 캔들의 볼린저밴드 레그 트리거 발화\n  BTCUSDT 15분 닫힌 캔들열을 입력받아 상방과 하방의 볼린저밴드 레그 트리거 발화 여부를 결정한다.\n\n  Background:\n    Given 대상 심볼은 \"BTCUSDT\"이다\n    And 캔들 주기는 \"15분\"이다\n    And 목표 정책은 \"기본 R 목표\"이다\n    And 시한은 24개 닫힌 캔들이다\n\n  Scenario: 상방 네 조건이 모두 참이면 상방 레그가 발화한다\n    Given 직전 닫힌 캔들의 종가는 상단선 안쪽이다\n    And 기준 닫힌 캔들은 양봉이며 종가가 상단선 밖에서 마감했다\n    And 기준 닫힌 캔들은 몸통 절반 이상이 상단선 밖이다\n    And 기준 닫힌 캔들은 스퀴즈 구간의 포함 경계에 있다\n    When 닫힌 캔들열로 볼린저밴드 레그 트리거 발화를 평가하면\n    Then 발화 결과는 1개이다\n    And 발화 방향은 \"상방\"이다\n    And 진입가는 기준봉 종가이다\n    And 손절가는 기준봉 저점이다\n    And 목표가는 기본 R 목표의 상방 목표가이다\n    And 시한은 24개 닫힌 캔들이다\n    And 하방 발화 결과는 없다\n\n  Scenario: 하방 네 조건이 모두 참이면 하방 레그가 발화한다\n    Given 직전 닫힌 캔들의 종가는 하단선 안쪽이다\n    And 기준 닫힌 캔들은 음봉이며 종가가 하단선 밖에서 마감했다\n    And 기준 닫힌 캔들은 몸통 절반 이상이 하단선 밖이다\n    And 기준 닫힌 캔들은 스퀴즈 구간의 포함 경계에 있다\n    When 닫힌 캔들열로 볼린저밴드 레그 트리거 발화를 평가하면\n    Then 발화 결과는 1개이다\n    And 발화 방향은 \"하방\"이다\n    And 진입가는 기준봉 종가이다\n    And 손절가는 기준봉 고점이다\n    And 목표가는 기본 R 목표의 하방 목표가이다\n    And 시한은 24개 닫힌 캔들이다\n    And 상방 발화 결과는 없다\n\n  Scenario Outline: 상방 발화 조건 중 하나라도 거짓이면 발화하지 않는다\n    Given 직전 닫힌 캔들의 상방 전이 상태는 \"<직전상태>\"이다\n    And 기준 닫힌 캔들의 상방 마감 상태는 \"<마감상태>\"이다\n    And 기준 닫힌 캔들의 상방 몸통 이탈 상태는 \"<몸통상태>\"이다\n    And 기준 닫힌 캔들의 스퀴즈 상태는 \"<스퀴즈상태>\"이다\n    When 닫힌 캔들열로 볼린저밴드 레그 트리거 발화를 평가하면\n    Then 발화 결과는 없다\n\n    Examples:\n      | 설명 | 직전상태 | 마감상태 | 몸통상태 | 스퀴즈상태 |\n      | 종가가 상단선 밖에서 마감하지 않음 | 직전 종가가 상단선 안쪽 | 양봉이나 종가는 상단선 밖이 아님 | 몸통 절반 이상이 상단선 밖 | 스퀴즈 포함 경계 |\n      | 몸통 절반 이상이 상단선 밖이 아님 | 직전 종가가 상단선 안쪽 | 양봉이고 종가는 상단선 밖 | 몸통 절반 미만만 상단선 밖 | 스퀴즈 포함 경계 |\n      | 직전 종가가 이미 상단선 밖임 | 직전 종가가 상단선 밖 | 양봉이고 종가는 상단선 밖 | 몸통 절반 이상이 상단선 밖 | 스퀴즈 포함 경계 |\n      | 스퀴즈 전제가 아님 | 직전 종가가 상단선 안쪽 | 양봉이고 종가는 상단선 밖 | 몸통 절반 이상이 상단선 밖 | 스퀴즈 초과 |\n      | 종가가 상단선 밖이어도 음봉이면 상방 발화가 아님 | 직전 종가가 상단선 안쪽 | 음봉이고 종가는 상단선 밖 | 몸통 절반 이상이 상단선 밖 | 스퀴즈 포함 경계 |\n\n  Scenario Outline: 하방 발화 조건 중 하나라도 거짓이면 발화하지 않는다\n    Given 직전 닫힌 캔들의 하방 전이 상태는 \"<직전상태>\"이다\n    And 기준 닫힌 캔들의 하방 마감 상태는 \"<마감상태>\"이다\n    And 기준 닫힌 캔들의 하방 몸통 이탈 상태는 \"<몸통상태>\"이다\n    And 기준 닫힌 캔들의 스퀴즈 상태는 \"<스퀴즈상태>\"이다\n    When 닫힌 캔들열로 볼린저밴드 레그 트리거 발화를 평가하면\n    Then 발화 결과는 없다\n\n    Examples:\n      | 설명 | 직전상태 | 마감상태 | 몸통상태 | 스퀴즈상태 |\n      | 종가가 하단선 밖에서 마감하지 않음 | 직전 종가가 하단선 안쪽 | 음봉이나 종가는 하단선 밖이 아님 | 몸통 절반 이상이 하단선 밖 | 스퀴즈 포함 경계 |\n      | 몸통 절반 이상이 하단선 밖이 아님 | 직전 종가가 하단선 안쪽 | 음봉이고 종가는 하단선 밖 | 몸통 절반 미만만 하단선 밖 | 스퀴즈 포함 경계 |\n      | 직전 종가가 이미 하단선 밖임 | 직전 종가가 하단선 밖 | 음봉이고 종가는 하단선 밖 | 몸통 절반 이상이 하단선 밖 | 스퀴즈 포함 경계 |\n      | 스퀴즈 전제가 아님 | 직전 종가가 하단선 안쪽 | 음봉이고 종가는 하단선 밖 | 몸통 절반 이상이 하단선 밖 | 스퀴즈 초과 |\n      | 종가가 하단선 밖이어도 양봉이면 하방 발화가 아님 | 직전 종가가 하단선 안쪽 | 양봉이고 종가는 하단선 밖 | 몸통 절반 이상이 하단선 밖 | 스퀴즈 포함 경계 |\n\n  Scenario: 상방 진입가와 손절가가 같아 리스크가 0이면 발화하지 않는다\n    Given 직전 닫힌 캔들의 종가는 상단선 안쪽이다\n    And 기준 닫힌 캔들은 양봉이며 종가가 상단선 밖에서 마감했다\n    And 기준 닫힌 캔들은 몸통 절반 이상이 상단선 밖이다\n    And 기준 닫힌 캔들은 스퀴즈 구간의 포함 경계에 있다\n    And 기준 닫힌 캔들의 종가와 저점은 같다\n    When 닫힌 캔들열로 볼린저밴드 레그 트리거 발화를 평가하면\n    Then 발화 결과는 없다\n\n  Scenario: 하방 진입가와 손절가가 같아 리스크가 0이면 발화하지 않는다\n    Given 직전 닫힌 캔들의 종가는 하단선 안쪽이다\n    And 기준 닫힌 캔들은 음봉이며 종가가 하단선 밖에서 마감했다\n    And 기준 닫힌 캔들은 몸통 절반 이상이 하단선 밖이다\n    And 기준 닫힌 캔들은 스퀴즈 구간의 포함 경계에 있다\n    And 기준 닫힌 캔들의 종가와 고점은 같다\n    When 닫힌 캔들열로 볼린저밴드 레그 트리거 발화를 평가하면\n    Then 발화 결과는 없다\n\n  Scenario: 상방과 하방 조건을 같은 닫힌 캔들에서 함께 만족할 수 없으므로 동시 발화하지 않는다\n    Given 직전 닫힌 캔들의 종가는 상단선과 하단선 안쪽이다\n    And 기준 닫힌 캔들은 상방 네 조건을 모두 만족한다\n    And 기준 닫힌 캔들은 스퀴즈 구간의 포함 경계에 있다\n    When 닫힌 캔들열로 볼린저밴드 레그 트리거 발화를 평가하면\n    Then 발화 결과는 1개이다\n    And 발화 방향은 \"상방\"이다\n    And 하방 발화 결과는 없다\n\n  Scenario: 입력의 마지막 닫힌 캔들이 발화 조건을 만족하지 않으면 발화하지 않는다\n    Given 닫힌 캔들열의 마지막 기준봉은 상방 네 조건을 모두 만족하지 않는다\n    And 닫힌 캔들열에는 닫히지 않은 최신 캔들이 포함되지 않는다\n    When 닫힌 캔들열로 볼린저밴드 레그 트리거 발화를 평가하면\n    Then 발화 결과는 없다\n",
  "files": [
    {
      "path": "bollinger_leg_trigger.feature",
      "content": "Feature: BTCUSDT 15분 닫힌 캔들의 볼린저밴드 레그 트리거 발화\n  BTCUSDT 15분 닫힌 캔들열을 입력받아 상방과 하방의 볼린저밴드 레그 트리거 발화 여부를 결정한다.\n\n  Background:\n    Given 대상 심볼은 \"BTCUSDT\"이다\n    And 캔들 주기는 \"15분\"이다\n    And 목표 정책은 \"기본 R 목표\"이다\n    And 시한은 24개 닫힌 캔들이다\n\n  Scenario: 상방 네 조건이 모두 참이면 상방 레그가 발화한다\n    Given 직전 닫힌 캔들의 종가는 상단선 안쪽이다\n    And 기준 닫힌 캔들은 양봉이며 종가가 상단선 밖에서 마감했다\n    And 기준 닫힌 캔들은 몸통 절반 이상이 상단선 밖이다\n    And 기준 닫힌 캔들은 스퀴즈 구간의 포함 경계에 있다\n    When 닫힌 캔들열로 볼린저밴드 레그 트리거 발화를 평가하면\n    Then 발화 결과는 1개이다\n    And 발화 방향은 \"상방\"이다\n    And 진입가는 기준봉 종가이다\n    And 손절가는 기준봉 저점이다\n    And 목표가는 기본 R 목표의 상방 목표가이다\n    And 시한은 24개 닫힌 캔들이다\n    And 하방 발화 결과는 없다\n\n  Scenario: 하방 네 조건이 모두 참이면 하방 레그가 발화한다\n    Given 직전 닫힌 캔들의 종가는 하단선 안쪽이다\n    And 기준 닫힌 캔들은 음봉이며 종가가 하단선 밖에서 마감했다\n    And 기준 닫힌 캔들은 몸통 절반 이상이 하단선 밖이다\n    And 기준 닫힌 캔들은 스퀴즈 구간의 포함 경계에 있다\n    When 닫힌 캔들열로 볼린저밴드 레그 트리거 발화를 평가하면\n    Then 발화 결과는 1개이다\n    And 발화 방향은 \"하방\"이다\n    And 진입가는 기준봉 종가이다\n    And 손절가는 기준봉 고점이다\n    And 목표가는 기본 R 목표의 하방 목표가이다\n    And 시한은 24개 닫힌 캔들이다\n    And 상방 발화 결과는 없다\n\n  Scenario Outline: 상방 발화 조건 중 하나라도 거짓이면 발화하지 않는다\n    Given 직전 닫힌 캔들의 상방 전이 상태는 \"<직전상태>\"이다\n    And 기준 닫힌 캔들의 상방 마감 상태는 \"<마감상태>\"이다\n    And 기준 닫힌 캔들의 상방 몸통 이탈 상태는 \"<몸통상태>\"이다\n    And 기준 닫힌 캔들의 스퀴즈 상태는 \"<스퀴즈상태>\"이다\n    When 닫힌 캔들열로 볼린저밴드 레그 트리거 발화를 평가하면\n    Then 발화 결과는 없다\n\n    Examples:\n      | 설명 | 직전상태 | 마감상태 | 몸통상태 | 스퀴즈상태 |\n      | 종가가 상단선 밖에서 마감하지 않음 | 직전 종가가 상단선 안쪽 | 양봉이나 종가는 상단선 밖이 아님 | 몸통 절반 이상이 상단선 밖 | 스퀴즈 포함 경계 |\n      | 몸통 절반 이상이 상단선 밖이 아님 | 직전 종가가 상단선 안쪽 | 양봉이고 종가는 상단선 밖 | 몸통 절반 미만만 상단선 밖 | 스퀴즈 포함 경계 |\n      | 직전 종가가 이미 상단선 밖임 | 직전 종가가 상단선 밖 | 양봉이고 종가는 상단선 밖 | 몸통 절반 이상이 상단선 밖 | 스퀴즈 포함 경계 |\n      | 스퀴즈 전제가 아님 | 직전 종가가 상단선 안쪽 | 양봉이고 종가는 상단선 밖 | 몸통 절반 이상이 상단선 밖 | 스퀴즈 초과 |\n      | 종가가 상단선 밖이어도 음봉이면 상방 발화가 아님 | 직전 종가가 상단선 안쪽 | 음봉이고 종가는 상단선 밖 | 몸통 절반 이상이 상단선 밖 | 스퀴즈 포함 경계 |\n\n  Scenario Outline: 하방 발화 조건 중 하나라도 거짓이면 발화하지 않는다\n    Given 직전 닫힌 캔들의 하방 전이 상태는 \"<직전상태>\"이다\n    And 기준 닫힌 캔들의 하방 마감 상태는 \"<마감상태>\"이다\n    And 기준 닫힌 캔들의 하방 몸통 이탈 상태는 \"<몸통상태>\"이다\n    And 기준 닫힌 캔들의 스퀴즈 상태는 \"<스퀴즈상태>\"이다\n    When 닫힌 캔들열로 볼린저밴드 레그 트리거 발화를 평가하면\n    Then 발화 결과는 없다\n\n    Examples:\n      | 설명 | 직전상태 | 마감상태 | 몸통상태 | 스퀴즈상태 |\n      | 종가가 하단선 밖에서 마감하지 않음 | 직전 종가가 하단선 안쪽 | 음봉이나 종가는 하단선 밖이 아님 | 몸통 절반 이상이 하단선 밖 | 스퀴즈 포함 경계 |\n      | 몸통 절반 이상이 하단선 밖이 아님 | 직전 종가가 하단선 안쪽 | 음봉이고 종가는 하단선 밖 | 몸통 절반 미만만 하단선 밖 | 스퀴즈 포함 경계 |\n      | 직전 종가가 이미 하단선 밖임 | 직전 종가가 하단선 밖 | 음봉이고 종가는 하단선 밖 | 몸통 절반 이상이 하단선 밖 | 스퀴즈 포함 경계 |\n      | 스퀴즈 전제가 아님 | 직전 종가가 하단선 안쪽 | 음봉이고 종가는 하단선 밖 | 몸통 절반 이상이 하단선 밖 | 스퀴즈 초과 |\n      | 종가가 하단선 밖이어도 양봉이면 하방 발화가 아님 | 직전 종가가 하단선 안쪽 | 양봉이고 종가는 하단선 밖 | 몸통 절반 이상이 하단선 밖 | 스퀴즈 포함 경계 |\n\n  Scenario: 상방 진입가와 손절가가 같아 리스크가 0이면 발화하지 않는다\n    Given 직전 닫힌 캔들의 종가는 상단선 안쪽이다\n    And 기준 닫힌 캔들은 양봉이며 종가가 상단선 밖에서 마감했다\n    And 기준 닫힌 캔들은 몸통 절반 이상이 상단선 밖이다\n    And 기준 닫힌 캔들은 스퀴즈 구간의 포함 경계에 있다\n    And 기준 닫힌 캔들의 종가와 저점은 같다\n    When 닫힌 캔들열로 볼린저밴드 레그 트리거 발화를 평가하면\n    Then 발화 결과는 없다\n\n  Scenario: 하방 진입가와 손절가가 같아 리스크가 0이면 발화하지 않는다\n    Given 직전 닫힌 캔들의 종가는 하단선 안쪽이다\n    And 기준 닫힌 캔들은 음봉이며 종가가 하단선 밖에서 마감했다\n    And 기준 닫힌 캔들은 몸통 절반 이상이 하단선 밖이다\n    And 기준 닫힌 캔들은 스퀴즈 구간의 포함 경계에 있다\n    And 기준 닫힌 캔들의 종가와 고점은 같다\n    When 닫힌 캔들열로 볼린저밴드 레그 트리거 발화를 평가하면\n    Then 발화 결과는 없다\n\n  Scenario: 상방과 하방 조건을 같은 닫힌 캔들에서 함께 만족할 수 없으므로 동시 발화하지 않는다\n    Given 직전 닫힌 캔들의 종가는 상단선과 하단선 안쪽이다\n    And 기준 닫힌 캔들은 상방 네 조건을 모두 만족한다\n    And 기준 닫힌 캔들은 스퀴즈 구간의 포함 경계에 있다\n    When 닫힌 캔들열로 볼린저밴드 레그 트리거 발화를 평가하면\n    Then 발화 결과는 1개이다\n    And 발화 방향은 \"상방\"이다\n    And 하방 발화 결과는 없다\n\n  Scenario: 입력의 마지막 닫힌 캔들이 발화 조건을 만족하지 않으면 발화하지 않는다\n    Given 닫힌 캔들열의 마지막 기준봉은 상방 네 조건을 모두 만족하지 않는다\n    And 닫힌 캔들열에는 닫히지 않은 최신 캔들이 포함되지 않는다\n    When 닫힌 캔들열로 볼린저밴드 레그 트리거 발화를 평가하면\n    Then 발화 결과는 없다\n"
    }
  ],
  "generated_at": "2026-07-24T00:05:54+09:00",
  "model": "gpt-5.5",
  "metadata": {
    "prompt_version": "refine_system:v1",
    "source_files": [
      "9885d9d1_input.json"
    ],
    "token_usage": {
      "input_tokens": 30392,
      "cached_input_tokens": 1408,
      "cache_write_input_tokens": 0,
      "output_tokens": 2657,
      "reasoning_output_tokens": 516
    }
  }
}
