{
  "brief_hash": "9885d9d1",
  "iteration": "001",
  "stage": "gen",
  "content": "// ===== FILE: bollinger_leg_trigger.feature =====\nFeature: BTCUSDT 15분 닫힌 캔들의 볼린저밴드 레그 트리거 발화\n  BTCUSDT 15분 닫힌 캔들열을 입력받아 상방과 하방의 볼린저밴드 레그 트리거 발화 여부를 결정한다.\n\n  Background:\n    Given 대상 심볼은 \"BTCUSDT\"이다\n    And 캔들 주기는 \"15분\"이다\n    And 목표 배수는 2이다\n    And 시한은 24개 닫힌 캔들이다\n\n  Scenario: 상방 네 조건이 모두 참이면 상방 레그가 발화한다\n    Given 직전 닫힌 캔들의 종가는 100이고 직전 상단선은 100이다\n    And 기준 닫힌 캔들의 시가는 98, 고가는 106, 저가는 97, 종가는 104이다\n    And 기준 닫힌 캔들의 상단선은 101이고 하단선은 91이다\n    And 기준 닫힌 캔들의 밴드폭은 최근 구간의 하위 25%에 포함된다\n    When 닫힌 캔들열로 볼린저밴드 레그 트리거 발화를 평가하면\n    Then 발화 결과는 1개이다\n    And 발화 방향은 \"상방\"이다\n    And 진입가는 104이다\n    And 손절가는 97이다\n    And 목표가는 118이다\n    And 시한은 24개 닫힌 캔들이다\n\n  Scenario: 하방 네 조건이 모두 참이면 하방 레그가 발화한다\n    Given 직전 닫힌 캔들의 종가는 90이고 직전 하단선은 90이다\n    And 기준 닫힌 캔들의 시가는 92, 고가는 93, 저가는 84, 종가는 86이다\n    And 기준 닫힌 캔들의 상단선은 100이고 하단선은 89이다\n    And 기준 닫힌 캔들의 밴드폭은 최근 구간의 하위 25%에 포함된다\n    When 닫힌 캔들열로 볼린저밴드 레그 트리거 발화를 평가하면\n    Then 발화 결과는 1개이다\n    And 발화 방향은 \"하방\"이다\n    And 진입가는 86이다\n    And 손절가는 93이다\n    And 목표가는 72이다\n    And 시한은 24개 닫힌 캔들이다\n\n  Scenario Outline: 상방 발화 조건 중 하나라도 거짓이면 발화하지 않는다\n    Given 직전 닫힌 캔들의 종가는 <직전종가>이고 직전 상단선은 <직전상단선>이다\n    And 기준 닫힌 캔들의 시가는 <시가>, 고가는 <고가>, 저가는 <저가>, 종가는 <종가>이다\n    And 기준 닫힌 캔들의 상단선은 <상단선>이고 하단선은 <하단선>이다\n    And 기준 닫힌 캔들의 밴드폭은 최근 구간의 하위 25%에 <스퀴즈포함>된다\n    When 닫힌 캔들열로 볼린저밴드 레그 트리거 발화를 평가하면\n    Then 발화 결과는 없다\n\n    Examples:\n      | 설명 | 직전종가 | 직전상단선 | 시가 | 고가 | 저가 | 종가 | 상단선 | 하단선 | 스퀴즈포함 |\n      | 양봉이지만 종가가 상단선 밖에서 마감하지 않음 | 100 | 100 | 98 | 102 | 97 | 101 | 101 | 91 | 포함 |\n      | 종가는 상단선 밖이지만 몸통 절반 이상이 상단선 밖이 아님 | 100 | 100 | 100 | 104 | 99 | 102 | 101.5 | 91 | 포함 |\n      | 직전 종가가 이미 상단선 밖임 | 101 | 100 | 98 | 106 | 97 | 104 | 101 | 91 | 포함 |\n      | 스퀴즈 전제가 아님 | 100 | 100 | 98 | 106 | 97 | 104 | 101 | 91 | 포함되지 |\n      | 종가가 상단선 밖이어도 음봉이면 상방 발화가 아님 | 100 | 100 | 105 | 106 | 101 | 104 | 101 | 91 | 포함 |\n\n  Scenario Outline: 하방 발화 조건 중 하나라도 거짓이면 발화하지 않는다\n    Given 직전 닫힌 캔들의 종가는 <직전종가>이고 직전 하단선은 <직전하단선>이다\n    And 기준 닫힌 캔들의 시가는 <시가>, 고가는 <고가>, 저가는 <저가>, 종가는 <종가>이다\n    And 기준 닫힌 캔들의 상단선은 <상단선>이고 하단선은 <하단선>이다\n    And 기준 닫힌 캔들의 밴드폭은 최근 구간의 하위 25%에 <스퀴즈포함>된다\n    When 닫힌 캔들열로 볼린저밴드 레그 트리거 발화를 평가하면\n    Then 발화 결과는 없다\n\n    Examples:\n      | 설명 | 직전종가 | 직전하단선 | 시가 | 고가 | 저가 | 종가 | 상단선 | 하단선 | 스퀴즈포함 |\n      | 음봉이지만 종가가 하단선 밖에서 마감하지 않음 | 90 | 90 | 92 | 93 | 89 | 89 | 100 | 89 | 포함 |\n      | 종가는 하단선 밖이지만 몸통 절반 이상이 하단선 밖이 아님 | 90 | 90 | 90 | 91 | 87 | 88 | 100 | 88.5 | 포함 |\n      | 직전 종가가 이미 하단선 밖임 | 89 | 90 | 92 | 93 | 84 | 86 | 100 | 89 | 포함 |\n      | 스퀴즈 전제가 아님 | 90 | 90 | 92 | 93 | 84 | 86 | 100 | 89 | 포함되지 |\n      | 종가가 하단선 밖이어도 양봉이면 하방 발화가 아님 | 90 | 90 | 85 | 87 | 84 | 86 | 100 | 89 | 포함 |\n\n  Scenario: 상방 진입가와 손절가가 같아 리스크가 0이면 발화하지 않는다\n    Given 직전 닫힌 캔들의 종가는 100이고 직전 상단선은 100이다\n    And 기준 닫힌 캔들의 시가는 98, 고가는 106, 저가는 104, 종가는 104이다\n    And 기준 닫힌 캔들의 상단선은 101이고 하단선은 91이다\n    And 기준 닫힌 캔들의 밴드폭은 최근 구간의 하위 25%에 포함된다\n    When 닫힌 캔들열로 볼린저밴드 레그 트리거 발화를 평가하면\n    Then 발화 결과는 없다\n\n  Scenario: 하방 진입가와 손절가가 같아 리스크가 0이면 발화하지 않는다\n    Given 직전 닫힌 캔들의 종가는 90이고 직전 하단선은 90이다\n    And 기준 닫힌 캔들의 시가는 92, 고가는 86, 저가는 84, 종가는 86이다\n    And 기준 닫힌 캔들의 상단선은 100이고 하단선은 89이다\n    And 기준 닫힌 캔들의 밴드폭은 최근 구간의 하위 25%에 포함된다\n    When 닫힌 캔들열로 볼린저밴드 레그 트리거 발화를 평가하면\n    Then 발화 결과는 없다\n\n  Scenario: 상방과 하방 조건을 같은 닫힌 캔들에서 함께 만족할 수 없으므로 동시 발화하지 않는다\n    Given 직전 닫힌 캔들의 종가는 95이고 직전 상단선은 100이고 직전 하단선은 90이다\n    And 기준 닫힌 캔들의 시가는 98, 고가는 106, 저가는 97, 종가는 104이다\n    And 기준 닫힌 캔들의 상단선은 101이고 하단선은 91이다\n    And 기준 닫힌 캔들의 밴드폭은 최근 구간의 하위 25%에 포함된다\n    When 닫힌 캔들열로 볼린저밴드 레그 트리거 발화를 평가하면\n    Then 발화 결과는 1개이다\n    And 발화 방향은 \"상방\"이다\n    And 하방 발화 결과는 없다\n\n  Scenario: 닫히지 않은 최신 캔들은 발화 평가에 사용하지 않는다\n    Given 마지막 닫힌 캔들까지는 발화 조건을 만족하는 캔들이 없다\n    And 닫히지 않은 최신 캔들은 상방 네 조건을 모두 만족하는 값으로 움직이고 있다\n    When 닫힌 캔들열로 볼린저밴드 레그 트리거 발화를 평가하면\n    Then 발화 결과는 없다\n",
  "files": [
    {
      "path": "bollinger_leg_trigger.feature",
      "content": "Feature: BTCUSDT 15분 닫힌 캔들의 볼린저밴드 레그 트리거 발화\n  BTCUSDT 15분 닫힌 캔들열을 입력받아 상방과 하방의 볼린저밴드 레그 트리거 발화 여부를 결정한다.\n\n  Background:\n    Given 대상 심볼은 \"BTCUSDT\"이다\n    And 캔들 주기는 \"15분\"이다\n    And 목표 배수는 2이다\n    And 시한은 24개 닫힌 캔들이다\n\n  Scenario: 상방 네 조건이 모두 참이면 상방 레그가 발화한다\n    Given 직전 닫힌 캔들의 종가는 100이고 직전 상단선은 100이다\n    And 기준 닫힌 캔들의 시가는 98, 고가는 106, 저가는 97, 종가는 104이다\n    And 기준 닫힌 캔들의 상단선은 101이고 하단선은 91이다\n    And 기준 닫힌 캔들의 밴드폭은 최근 구간의 하위 25%에 포함된다\n    When 닫힌 캔들열로 볼린저밴드 레그 트리거 발화를 평가하면\n    Then 발화 결과는 1개이다\n    And 발화 방향은 \"상방\"이다\n    And 진입가는 104이다\n    And 손절가는 97이다\n    And 목표가는 118이다\n    And 시한은 24개 닫힌 캔들이다\n\n  Scenario: 하방 네 조건이 모두 참이면 하방 레그가 발화한다\n    Given 직전 닫힌 캔들의 종가는 90이고 직전 하단선은 90이다\n    And 기준 닫힌 캔들의 시가는 92, 고가는 93, 저가는 84, 종가는 86이다\n    And 기준 닫힌 캔들의 상단선은 100이고 하단선은 89이다\n    And 기준 닫힌 캔들의 밴드폭은 최근 구간의 하위 25%에 포함된다\n    When 닫힌 캔들열로 볼린저밴드 레그 트리거 발화를 평가하면\n    Then 발화 결과는 1개이다\n    And 발화 방향은 \"하방\"이다\n    And 진입가는 86이다\n    And 손절가는 93이다\n    And 목표가는 72이다\n    And 시한은 24개 닫힌 캔들이다\n\n  Scenario Outline: 상방 발화 조건 중 하나라도 거짓이면 발화하지 않는다\n    Given 직전 닫힌 캔들의 종가는 <직전종가>이고 직전 상단선은 <직전상단선>이다\n    And 기준 닫힌 캔들의 시가는 <시가>, 고가는 <고가>, 저가는 <저가>, 종가는 <종가>이다\n    And 기준 닫힌 캔들의 상단선은 <상단선>이고 하단선은 <하단선>이다\n    And 기준 닫힌 캔들의 밴드폭은 최근 구간의 하위 25%에 <스퀴즈포함>된다\n    When 닫힌 캔들열로 볼린저밴드 레그 트리거 발화를 평가하면\n    Then 발화 결과는 없다\n\n    Examples:\n      | 설명 | 직전종가 | 직전상단선 | 시가 | 고가 | 저가 | 종가 | 상단선 | 하단선 | 스퀴즈포함 |\n      | 양봉이지만 종가가 상단선 밖에서 마감하지 않음 | 100 | 100 | 98 | 102 | 97 | 101 | 101 | 91 | 포함 |\n      | 종가는 상단선 밖이지만 몸통 절반 이상이 상단선 밖이 아님 | 100 | 100 | 100 | 104 | 99 | 102 | 101.5 | 91 | 포함 |\n      | 직전 종가가 이미 상단선 밖임 | 101 | 100 | 98 | 106 | 97 | 104 | 101 | 91 | 포함 |\n      | 스퀴즈 전제가 아님 | 100 | 100 | 98 | 106 | 97 | 104 | 101 | 91 | 포함되지 |\n      | 종가가 상단선 밖이어도 음봉이면 상방 발화가 아님 | 100 | 100 | 105 | 106 | 101 | 104 | 101 | 91 | 포함 |\n\n  Scenario Outline: 하방 발화 조건 중 하나라도 거짓이면 발화하지 않는다\n    Given 직전 닫힌 캔들의 종가는 <직전종가>이고 직전 하단선은 <직전하단선>이다\n    And 기준 닫힌 캔들의 시가는 <시가>, 고가는 <고가>, 저가는 <저가>, 종가는 <종가>이다\n    And 기준 닫힌 캔들의 상단선은 <상단선>이고 하단선은 <하단선>이다\n    And 기준 닫힌 캔들의 밴드폭은 최근 구간의 하위 25%에 <스퀴즈포함>된다\n    When 닫힌 캔들열로 볼린저밴드 레그 트리거 발화를 평가하면\n    Then 발화 결과는 없다\n\n    Examples:\n      | 설명 | 직전종가 | 직전하단선 | 시가 | 고가 | 저가 | 종가 | 상단선 | 하단선 | 스퀴즈포함 |\n      | 음봉이지만 종가가 하단선 밖에서 마감하지 않음 | 90 | 90 | 92 | 93 | 89 | 89 | 100 | 89 | 포함 |\n      | 종가는 하단선 밖이지만 몸통 절반 이상이 하단선 밖이 아님 | 90 | 90 | 90 | 91 | 87 | 88 | 100 | 88.5 | 포함 |\n      | 직전 종가가 이미 하단선 밖임 | 89 | 90 | 92 | 93 | 84 | 86 | 100 | 89 | 포함 |\n      | 스퀴즈 전제가 아님 | 90 | 90 | 92 | 93 | 84 | 86 | 100 | 89 | 포함되지 |\n      | 종가가 하단선 밖이어도 양봉이면 하방 발화가 아님 | 90 | 90 | 85 | 87 | 84 | 86 | 100 | 89 | 포함 |\n\n  Scenario: 상방 진입가와 손절가가 같아 리스크가 0이면 발화하지 않는다\n    Given 직전 닫힌 캔들의 종가는 100이고 직전 상단선은 100이다\n    And 기준 닫힌 캔들의 시가는 98, 고가는 106, 저가는 104, 종가는 104이다\n    And 기준 닫힌 캔들의 상단선은 101이고 하단선은 91이다\n    And 기준 닫힌 캔들의 밴드폭은 최근 구간의 하위 25%에 포함된다\n    When 닫힌 캔들열로 볼린저밴드 레그 트리거 발화를 평가하면\n    Then 발화 결과는 없다\n\n  Scenario: 하방 진입가와 손절가가 같아 리스크가 0이면 발화하지 않는다\n    Given 직전 닫힌 캔들의 종가는 90이고 직전 하단선은 90이다\n    And 기준 닫힌 캔들의 시가는 92, 고가는 86, 저가는 84, 종가는 86이다\n    And 기준 닫힌 캔들의 상단선은 100이고 하단선은 89이다\n    And 기준 닫힌 캔들의 밴드폭은 최근 구간의 하위 25%에 포함된다\n    When 닫힌 캔들열로 볼린저밴드 레그 트리거 발화를 평가하면\n    Then 발화 결과는 없다\n\n  Scenario: 상방과 하방 조건을 같은 닫힌 캔들에서 함께 만족할 수 없으므로 동시 발화하지 않는다\n    Given 직전 닫힌 캔들의 종가는 95이고 직전 상단선은 100이고 직전 하단선은 90이다\n    And 기준 닫힌 캔들의 시가는 98, 고가는 106, 저가는 97, 종가는 104이다\n    And 기준 닫힌 캔들의 상단선은 101이고 하단선은 91이다\n    And 기준 닫힌 캔들의 밴드폭은 최근 구간의 하위 25%에 포함된다\n    When 닫힌 캔들열로 볼린저밴드 레그 트리거 발화를 평가하면\n    Then 발화 결과는 1개이다\n    And 발화 방향은 \"상방\"이다\n    And 하방 발화 결과는 없다\n\n  Scenario: 닫히지 않은 최신 캔들은 발화 평가에 사용하지 않는다\n    Given 마지막 닫힌 캔들까지는 발화 조건을 만족하는 캔들이 없다\n    And 닫히지 않은 최신 캔들은 상방 네 조건을 모두 만족하는 값으로 움직이고 있다\n    When 닫힌 캔들열로 볼린저밴드 레그 트리거 발화를 평가하면\n    Then 발화 결과는 없다\n"
    }
  ],
  "generated_at": "2026-07-23T23:59:55+09:00",
  "model": "gpt-5.5",
  "metadata": {
    "prompt_version": "gen_system:v1",
    "source_files": [
      "9885d9d1_input.json"
    ],
    "token_usage": {
      "input_tokens": 50828,
      "cached_input_tokens": 25344,
      "cache_write_input_tokens": 0,
      "output_tokens": 2967,
      "reasoning_output_tokens": 646
    }
  }
}
