{
  "brief_hash": "f1ba346d",
  "iteration": "001",
  "stage": "gen",
  "content": "// ===== FILE: refund.rules.md =====\n# 환불 정책 — 도메인 규칙 예시표\n\n> 정책 원문(환불 정책 도메인 설계)에서 발굴한 내부 규칙을 입력→출력 예시표로 고정한다.\n> 관찰 가능한 경계(입력/결과)는 boundary feature 소관이고, 이 문서는 **그 결과를 산출하는 산식·중간값**만 담는다.\n> 모든 기대 출력값은 각 규칙의 산식에서 재계산으로 검산 가능하다. 인터페이스(클래스·메서드·시그니처)는 정하지 않는다.\n\n---\n\n### PRORATION 일할 환불금액\n규칙: 잔여 일수에 비례해 환불하되, 잔여==총일수면 전액·잔여==0이면 0원이다. 소수점은 절사(floor)한다.\n산식: 환불금액 = floor(결제금액 / 총일수) × 잔여일수  (단, 잔여일수==총일수 → 결제금액 전액 / 잔여일수==0 → 0)\n\n| 결제금액 | 총일수 | 잔여일수 | 환불금액 |\n|---|---|---|---|\n| 30000 | 30 | 30 | 30000 |\n| 30000 | 30 | 29 | 29000 |\n| 30000 | 30 | 15 | 15000 |\n| 30000 | 30 | 1 | 1000 |\n| 30000 | 30 | 0 | 0 |\n| 10000 | 30 | 7 | 2331 |\n\n검산: 단가 = floor(10000/30) = floor(333.33) = 333(정수 나눗셈); 환불금액 = 333 × 7 = 2331 (절사는 단가 단계에서 먼저 적용 — floor(10000×7/30)=2333이 아님). 잔여==총(30)인 첫 행은 산식이 아닌 전액 규칙으로 30000, 잔여==0인 행은 0.\n\n---\n\n### PRORATION 구독 기간 유효성\n규칙: 총 구독 일수가 0 이하이면 일할 계산이 정의되지 않으므로 오류다.\n산식: 판정 = (총일수 <= 0) ? 오류 : 계산 진행\n\n| 총일수 | 판정 |\n|---|---|\n| 1 | 계산 진행 |\n| 0 | 오류 |\n| -1 | 오류 |\n\n검산: 총일수 1은 경계 안(단가=floor(결제금액/1)로 정의됨), 0은 나눗셈 정의 불가 → 오류. 0 직전/직후 짝으로 경계 고정.\n\n---\n\n### MANUAL 수동 지정 환불금액\n규칙: 지정 금액을 그대로 환불하되, 환불 가능 금액을 초과하거나 0 이하이면 오류다.\n산식: 환불금액 = 지정금액  (단, 지정금액 > 환불가능금액 → 오류 / 지정금액 <= 0 → 오류)\n\n| 지정금액 | 환불가능금액 | 결과 |\n|---|---|---|\n| 1 | 30000 | 1 |\n| 10000 | 30000 | 10000 |\n| 30000 | 30000 | 30000 |\n| 30001 | 30000 | 오류 |\n| 0 | 30000 | 오류 |\n| -1 | 30000 | 오류 |\n\n검산: 지정금액==환불가능금액(30000)은 등호 경계로 허용, +1(30001)은 초과 → 오류. 최소 허용은 1(양수), 0은 <=0 → 오류로 0 직전/직후 짝을 둔다.\n\n---\n\n### 7일 이하 무료(청약 철회)\n규칙: 결제일로부터 경과일이 7일 이하이면 전액 환불(무료)이고, 8일 이상이면 PRORATION을 적용한다.\n산식: 판정 = (경과일 <= 7) ? 전액환불 : PRORATION 적용   (경과일 = 결제 시각과 요청 시각의 UTC 날짜 차, 시/분/초 제거)\n\n| 경과일 | 판정 |\n|---|---|\n| 0 | 전액 환불 |\n| 7 | 전액 환불 |\n| 8 | PRORATION 적용 |\n\n검산: 경과일 7은 무료 경계(<=7 등호 포함)로 전액, 8은 경계 직후로 PRORATION 위임. 7/8 짝으로 경계를 팽팽하게 고정한다.\n\n---\n\n### 정책 우선순위 (판정 순서)\n불변식: ∀(MANUAL 지정 유무 m, 경과일 d, 잔여일수). MANUAL 지정이 있으면 결과는 항상 MANUAL 지정 금액이며(경과일·잔여일 무관), MANUAL이 없고 d<=7이면 전액 환불, 그 외에는 PRORATION이다. (어느 정책이 발동해도 이 순서가 성립한다)\n\n| MANUAL 지정 | 경과일 | 적용 정책 | 어느 경계 |\n|---|---|---|---|\n| 있음 | 3 | MANUAL | MANUAL이 7일 무료 조건(d<=7)을 덮는 증인 |\n| 있음 | 20 | MANUAL | MANUAL이 PRORATION 조건을 덮는 증인 |\n| 없음 | 7 | 7일 무료 전액 | 무료가 PRORATION을 이기는 경계(d==7) 증인 |\n| 없음 | 8 | PRORATION | 무료 탈락 후 최하위 정책으로 내려가는 증인 |\n\n검산: 경과일 3(<=7)인데도 MANUAL 지정이 있으면 결과가 MANUAL — 무료 조건을 만족해도 상위 정책이 이김을 witness로 보인다. 경과일 7/8 짝은 MANUAL 없을 때 무료↔PRORATION 경계가 정확히 7에서 갈림을 등호로 만족시킨다.\n\n---\n\n### 환불 가능 금액 상한 불변식\n불변식: ∀(주문금액 a, 이미 환불된 금액 c, 승인되는 환불금액 r). 0 < r ≤ a - c. (환불 가능 금액 = a - c이며 어떤 정책으로 산출된 r도 이를 초과할 수 없고 양수여야 한다)\n\n| 주문금액 a | 이미환불 c | 환불금액 r | 판정 | 어느 경계 |\n|---|---|---|---|---|\n| 30000 | 0 | 30000 | 허용 | r == a-c 등호(가능금액 소진, 전액) tight witness |\n| 30000 | 0 | 30001 | 오류 | 상한 등호를 +1 넘어선 증인 |\n| 30000 | 10000 | 20000 | 허용 | 부분 환불 후 가능금액 재계산(a-c=20000) 소진 witness |\n| 30000 | 10000 | 20001 | 오류 | 재계산된 상한을 넘어선 증인 |\n\n검산: 가능금액 = a - c. 첫 행 30000-0=30000이라 r=30000이 등호로 상한에 정확히 닿음(허용), +1은 초과(오류). 부분 환불 행은 c=10000이라 상한이 20000으로 좁혀지고, r=20000이 등호로 닿음 — 상한이 이미 환불된 금액만큼 줄어듦을 witness가 보인다.\n\n---\n\n### 환불 유형 결정\n규칙: 환불금액이 환불 가능 금액과 같으면 FULL, 작으면 PARTIAL이다.\n산식: 유형 = (환불금액 == 환불가능금액) ? FULL : PARTIAL\n\n| 환불금액 | 환불가능금액 | 유형 |\n|---|---|---|\n| 30000 | 30000 | FULL |\n| 29999 | 30000 | PARTIAL |\n| 1 | 30000 | PARTIAL |\n\n검산: 환불금액==가능금액(30000) 등호 경계는 FULL, 그보다 1 작은 29999는 PARTIAL로 등호 경계 직전/직후 짝을 둔다.\n\n---\n\n### 주문 상태 전이\n규칙: 환불 적용 후 (이미 취소된 금액 + 이번 환불금액)이 주문금액에 도달하면 REFUNDED, 미달이면 PARTIALLY_REFUNDED로 전이한다. REFUNDED/PENDING/FAILED 상태에서는 환불이 불가하다.\n산식: 결과상태 = (누적취소금액 + 환불금액 == 주문금액) ? REFUNDED : PARTIALLY_REFUNDED   (단, 환불 전 상태가 PAID·PARTIALLY_REFUNDED가 아니면 불가 예외)\n\n| 환불 전 상태 | 주문금액 | 누적취소 | 이번 환불 | 결과 |\n|---|---|---|---|---|\n| PAID | 30000 | 0 | 30000 | REFUNDED |\n| PAID | 30000 | 0 | 20000 | PARTIALLY_REFUNDED |\n| PARTIALLY_REFUNDED | 30000 | 20000 | 10000 | REFUNDED |\n| PARTIALLY_REFUNDED | 30000 | 20000 | 5000 | PARTIALLY_REFUNDED |\n| REFUNDED | 30000 | 30000 | 1 | 불가 예외 |\n| PENDING | 30000 | 0 | 30000 | 불가 예외 |\n| FAILED | 30000 | 0 | 30000 | 불가 예외 |\n\n검산: 3행은 누적취소 20000 + 환불 10000 == 30000이라 등호 도달 → REFUNDED, 4행은 20000+5000=25000<30000이라 미도달 → PARTIALLY_REFUNDED로 전액 도달 경계의 안/밖 짝을 이룬다. PAID·PARTIALLY_REFUNDED만 진입 가능하고 REFUNDED/PENDING/FAILED는 불가 — 허용 상태 직전/직후를 증인으로 둔다.\n\n---\n\n### 환불 엔티티 상태 전이\n규칙: 환불은 REQUESTED에서 결제 취소 결과에 따라 SUCCEEDED/FAILED/TIMED_OUT 중 하나로 전이한다.\n산식: 결과상태 = 취소성공 → SUCCEEDED / 명확한 거부 → FAILED / 결과 불확실 → TIMED_OUT\n\n| 환불 전 상태 | 결제 취소 결과 | 결과 상태 |\n|---|---|---|\n| REQUESTED | 성공 | SUCCEEDED |\n| REQUESTED | 명확한 거부(잔액 부족 등) | FAILED |\n| REQUESTED | 결과 불확실(네트워크 오류 등) | TIMED_OUT |\n\n검산: 셋 모두 진입 상태는 REQUESTED로 동일하고, 취소 결과 셋(성공/명확거부/불확실)이 각 결과 상태에 1:1 대응 — 같은 시작점에서 결과에 따라 갈라지는 세 전이를 witness로 나란히 둔다. TIMED_OUT은 관리자 수동 처리 대상이라 SUCCEEDED/FAILED와 구분된다.\n",
  "files": [
    {
      "path": "refund.rules.md",
      "content": "# 환불 정책 — 도메인 규칙 예시표\n\n> 정책 원문(환불 정책 도메인 설계)에서 발굴한 내부 규칙을 입력→출력 예시표로 고정한다.\n> 관찰 가능한 경계(입력/결과)는 boundary feature 소관이고, 이 문서는 **그 결과를 산출하는 산식·중간값**만 담는다.\n> 모든 기대 출력값은 각 규칙의 산식에서 재계산으로 검산 가능하다. 인터페이스(클래스·메서드·시그니처)는 정하지 않는다.\n\n---\n\n### PRORATION 일할 환불금액\n규칙: 잔여 일수에 비례해 환불하되, 잔여==총일수면 전액·잔여==0이면 0원이다. 소수점은 절사(floor)한다.\n산식: 환불금액 = floor(결제금액 / 총일수) × 잔여일수  (단, 잔여일수==총일수 → 결제금액 전액 / 잔여일수==0 → 0)\n\n| 결제금액 | 총일수 | 잔여일수 | 환불금액 |\n|---|---|---|---|\n| 30000 | 30 | 30 | 30000 |\n| 30000 | 30 | 29 | 29000 |\n| 30000 | 30 | 15 | 15000 |\n| 30000 | 30 | 1 | 1000 |\n| 30000 | 30 | 0 | 0 |\n| 10000 | 30 | 7 | 2331 |\n\n검산: 단가 = floor(10000/30) = floor(333.33) = 333(정수 나눗셈); 환불금액 = 333 × 7 = 2331 (절사는 단가 단계에서 먼저 적용 — floor(10000×7/30)=2333이 아님). 잔여==총(30)인 첫 행은 산식이 아닌 전액 규칙으로 30000, 잔여==0인 행은 0.\n\n---\n\n### PRORATION 구독 기간 유효성\n규칙: 총 구독 일수가 0 이하이면 일할 계산이 정의되지 않으므로 오류다.\n산식: 판정 = (총일수 <= 0) ? 오류 : 계산 진행\n\n| 총일수 | 판정 |\n|---|---|\n| 1 | 계산 진행 |\n| 0 | 오류 |\n| -1 | 오류 |\n\n검산: 총일수 1은 경계 안(단가=floor(결제금액/1)로 정의됨), 0은 나눗셈 정의 불가 → 오류. 0 직전/직후 짝으로 경계 고정.\n\n---\n\n### MANUAL 수동 지정 환불금액\n규칙: 지정 금액을 그대로 환불하되, 환불 가능 금액을 초과하거나 0 이하이면 오류다.\n산식: 환불금액 = 지정금액  (단, 지정금액 > 환불가능금액 → 오류 / 지정금액 <= 0 → 오류)\n\n| 지정금액 | 환불가능금액 | 결과 |\n|---|---|---|\n| 1 | 30000 | 1 |\n| 10000 | 30000 | 10000 |\n| 30000 | 30000 | 30000 |\n| 30001 | 30000 | 오류 |\n| 0 | 30000 | 오류 |\n| -1 | 30000 | 오류 |\n\n검산: 지정금액==환불가능금액(30000)은 등호 경계로 허용, +1(30001)은 초과 → 오류. 최소 허용은 1(양수), 0은 <=0 → 오류로 0 직전/직후 짝을 둔다.\n\n---\n\n### 7일 이하 무료(청약 철회)\n규칙: 결제일로부터 경과일이 7일 이하이면 전액 환불(무료)이고, 8일 이상이면 PRORATION을 적용한다.\n산식: 판정 = (경과일 <= 7) ? 전액환불 : PRORATION 적용   (경과일 = 결제 시각과 요청 시각의 UTC 날짜 차, 시/분/초 제거)\n\n| 경과일 | 판정 |\n|---|---|\n| 0 | 전액 환불 |\n| 7 | 전액 환불 |\n| 8 | PRORATION 적용 |\n\n검산: 경과일 7은 무료 경계(<=7 등호 포함)로 전액, 8은 경계 직후로 PRORATION 위임. 7/8 짝으로 경계를 팽팽하게 고정한다.\n\n---\n\n### 정책 우선순위 (판정 순서)\n불변식: ∀(MANUAL 지정 유무 m, 경과일 d, 잔여일수). MANUAL 지정이 있으면 결과는 항상 MANUAL 지정 금액이며(경과일·잔여일 무관), MANUAL이 없고 d<=7이면 전액 환불, 그 외에는 PRORATION이다. (어느 정책이 발동해도 이 순서가 성립한다)\n\n| MANUAL 지정 | 경과일 | 적용 정책 | 어느 경계 |\n|---|---|---|---|\n| 있음 | 3 | MANUAL | MANUAL이 7일 무료 조건(d<=7)을 덮는 증인 |\n| 있음 | 20 | MANUAL | MANUAL이 PRORATION 조건을 덮는 증인 |\n| 없음 | 7 | 7일 무료 전액 | 무료가 PRORATION을 이기는 경계(d==7) 증인 |\n| 없음 | 8 | PRORATION | 무료 탈락 후 최하위 정책으로 내려가는 증인 |\n\n검산: 경과일 3(<=7)인데도 MANUAL 지정이 있으면 결과가 MANUAL — 무료 조건을 만족해도 상위 정책이 이김을 witness로 보인다. 경과일 7/8 짝은 MANUAL 없을 때 무료↔PRORATION 경계가 정확히 7에서 갈림을 등호로 만족시킨다.\n\n---\n\n### 환불 가능 금액 상한 불변식\n불변식: ∀(주문금액 a, 이미 환불된 금액 c, 승인되는 환불금액 r). 0 < r ≤ a - c. (환불 가능 금액 = a - c이며 어떤 정책으로 산출된 r도 이를 초과할 수 없고 양수여야 한다)\n\n| 주문금액 a | 이미환불 c | 환불금액 r | 판정 | 어느 경계 |\n|---|---|---|---|---|\n| 30000 | 0 | 30000 | 허용 | r == a-c 등호(가능금액 소진, 전액) tight witness |\n| 30000 | 0 | 30001 | 오류 | 상한 등호를 +1 넘어선 증인 |\n| 30000 | 10000 | 20000 | 허용 | 부분 환불 후 가능금액 재계산(a-c=20000) 소진 witness |\n| 30000 | 10000 | 20001 | 오류 | 재계산된 상한을 넘어선 증인 |\n\n검산: 가능금액 = a - c. 첫 행 30000-0=30000이라 r=30000이 등호로 상한에 정확히 닿음(허용), +1은 초과(오류). 부분 환불 행은 c=10000이라 상한이 20000으로 좁혀지고, r=20000이 등호로 닿음 — 상한이 이미 환불된 금액만큼 줄어듦을 witness가 보인다.\n\n---\n\n### 환불 유형 결정\n규칙: 환불금액이 환불 가능 금액과 같으면 FULL, 작으면 PARTIAL이다.\n산식: 유형 = (환불금액 == 환불가능금액) ? FULL : PARTIAL\n\n| 환불금액 | 환불가능금액 | 유형 |\n|---|---|---|\n| 30000 | 30000 | FULL |\n| 29999 | 30000 | PARTIAL |\n| 1 | 30000 | PARTIAL |\n\n검산: 환불금액==가능금액(30000) 등호 경계는 FULL, 그보다 1 작은 29999는 PARTIAL로 등호 경계 직전/직후 짝을 둔다.\n\n---\n\n### 주문 상태 전이\n규칙: 환불 적용 후 (이미 취소된 금액 + 이번 환불금액)이 주문금액에 도달하면 REFUNDED, 미달이면 PARTIALLY_REFUNDED로 전이한다. REFUNDED/PENDING/FAILED 상태에서는 환불이 불가하다.\n산식: 결과상태 = (누적취소금액 + 환불금액 == 주문금액) ? REFUNDED : PARTIALLY_REFUNDED   (단, 환불 전 상태가 PAID·PARTIALLY_REFUNDED가 아니면 불가 예외)\n\n| 환불 전 상태 | 주문금액 | 누적취소 | 이번 환불 | 결과 |\n|---|---|---|---|---|\n| PAID | 30000 | 0 | 30000 | REFUNDED |\n| PAID | 30000 | 0 | 20000 | PARTIALLY_REFUNDED |\n| PARTIALLY_REFUNDED | 30000 | 20000 | 10000 | REFUNDED |\n| PARTIALLY_REFUNDED | 30000 | 20000 | 5000 | PARTIALLY_REFUNDED |\n| REFUNDED | 30000 | 30000 | 1 | 불가 예외 |\n| PENDING | 30000 | 0 | 30000 | 불가 예외 |\n| FAILED | 30000 | 0 | 30000 | 불가 예외 |\n\n검산: 3행은 누적취소 20000 + 환불 10000 == 30000이라 등호 도달 → REFUNDED, 4행은 20000+5000=25000<30000이라 미도달 → PARTIALLY_REFUNDED로 전액 도달 경계의 안/밖 짝을 이룬다. PAID·PARTIALLY_REFUNDED만 진입 가능하고 REFUNDED/PENDING/FAILED는 불가 — 허용 상태 직전/직후를 증인으로 둔다.\n\n---\n\n### 환불 엔티티 상태 전이\n규칙: 환불은 REQUESTED에서 결제 취소 결과에 따라 SUCCEEDED/FAILED/TIMED_OUT 중 하나로 전이한다.\n산식: 결과상태 = 취소성공 → SUCCEEDED / 명확한 거부 → FAILED / 결과 불확실 → TIMED_OUT\n\n| 환불 전 상태 | 결제 취소 결과 | 결과 상태 |\n|---|---|---|\n| REQUESTED | 성공 | SUCCEEDED |\n| REQUESTED | 명확한 거부(잔액 부족 등) | FAILED |\n| REQUESTED | 결과 불확실(네트워크 오류 등) | TIMED_OUT |\n\n검산: 셋 모두 진입 상태는 REQUESTED로 동일하고, 취소 결과 셋(성공/명확거부/불확실)이 각 결과 상태에 1:1 대응 — 같은 시작점에서 결과에 따라 갈라지는 세 전이를 witness로 나란히 둔다. TIMED_OUT은 관리자 수동 처리 대상이라 SUCCEEDED/FAILED와 구분된다.\n"
    }
  ],
  "generated_at": "2026-07-21T23:03:22+09:00",
  "model": "claude-sonnet-4-6",
  "metadata": {
    "prompt_version": "gen_system:v1",
    "source_files": [
      "f1ba346d_input.json"
    ]
  }
}
