{
  "brief_hash": "f1ba346d",
  "iteration": "001",
  "stage": "gen",
  "content": "// ===== FILE: refund.rules.md =====\n# 환불 정책 도메인 규칙 예시표\n\n> boundary feature가 담지 않는 \"규칙이 구체적으로 어떤 값을 내는가\"를 고정한다.\n> 모든 기대 출력값은 각 규칙의 산식에서 재계산으로 검증 가능하다. 클래스·메서드·시그니처는 정하지 않는다.\n\n**공통 정의**\n- 환불가능금액 = 주문금액 − 이미 환불된 금액. 어떤 환불도 이를 초과할 수 없다.\n- 일수는 UTC 날짜 기준(시/분/초 제거), 금액은 소수점 floor 절사.\n\n---\n\n### PRORATION 일할 환불금액\n규칙: 잔여 일수에 비례해 환불하되, 잔여==총일수면 전액, 잔여==0이면 0원, 총일수<=0이면 오류.\n산식: 일할단가 = floor(결제금액 / 총일수); 환불금액 = 일할단가 × 잔여일수\n\n| 결제금액 | 총일수 | 잔여일수 | 환불금액 |\n|---|---|---|---|\n| 30000 | 30 | 30 | 30000 |\n| 30000 | 30 | 29 | 29000 |\n| 30000 | 30 | 1 | 1000 |\n| 30000 | 30 | 0 | 0 |\n| 10000 | 30 | 7 | 2331 |\n| 10000 | 30 | 8 | 2664 |\n| 10000 | 0 | 5 | 오류 |\n\n검산: floor(10000/30)=333; 333×7=2331, 333×8=2664 (절사 경계 안/밖 짝). floor(30000/30)=1000; 1000×30=30000(전액 경계 안), 1000×29=29000(경계 밖), 1000×0=0(0원 경계 안).\n\n---\n\n### MANUAL 수동 지정\n규칙: 지정금액을 환불금액으로 하되, 환불가능금액을 초과하거나 0 이하이면 오류.\n산식: 환불금액 = 지정금액 (조건: 0 < 지정금액 ≤ 환불가능금액)\n\n| 지정금액 | 환불가능금액 | 환불금액 |\n|---|---|---|\n| 5000 | 10000 | 5000 |\n| 10000 | 10000 | 10000 |\n| 10001 | 10000 | 오류 |\n| 1 | 10000 | 1 |\n| 0 | 10000 | 오류 |\n\n검산: 상한 경계 짝 — 10000(=상한, 허용) / 10001(>상한, 오류). 하한 경계 짝 — 1(>0, 허용) / 0(≤0, 오류).\n\n---\n\n### 7일 이하 무료 (청약철회)\n규칙: MANUAL 지정이 없을 때, 결제일로부터 경과일이 7 이하이면 전액 환불, 8 이상이면 PRORATION 적용.\n산식: 경과일 ≤ 7 → 환불금액 = 결제금액; 경과일 ≥ 8 → PRORATION 산식 위임\n\n| 경과일 | 결제금액 | 환불금액 |\n|---|---|---|\n| 0 | 30000 | 30000 |\n| 7 | 30000 | 30000 |\n| 8 | 30000 | PRORATION 위임 |\n\n검산: 무료 경계 짝 — 7일(≤7, 전액=결제금액 30000) / 8일(≥8, PRORATION으로 위임).\n\n---\n\n### 정책 우선순위 (판정 규칙)\n규칙: MANUAL > 7일 이하 무료 > PRORATION. 상위 규칙이 발동하면 하위 규칙은 판정하지 않는다.\n산식: 판정 — MANUAL 지정 있으면 MANUAL, 없고 경과일≤7이면 무료(전액), 그 외 PRORATION\n\n| MANUAL 지정 | 경과일 | 적용 정책 |\n|---|---|---|\n| 있음 | 3 | MANUAL |\n| 있음 | 30 | MANUAL |\n| 없음 | 7 | 무료(전액) |\n| 없음 | 8 | PRORATION |\n\n검산: MANUAL이 경과일 3(무료 구간)과 30(PRORATION 구간) 양쪽에서 우선함을 보이는 짝 — MANUAL이 두 하위 규칙 모두를 가림. MANUAL 없을 때 경과일 7/8 짝으로 무료↔PRORATION 경계 확인.\n\n---\n\n### 환불 유형 결정 (판정 규칙)\n규칙: 확정된 환불금액이 환불가능금액과 같으면 FULL, 작으면 PARTIAL.\n산식: 판정 — 환불금액 == 환불가능금액 → FULL; 환불금액 < 환불가능금액 → PARTIAL\n\n| 환불금액 | 환불가능금액 | 유형 |\n|---|---|---|\n| 10000 | 10000 | FULL |\n| 9999 | 10000 | PARTIAL |\n\n검산: 등호 경계 짝 — 10000(==, FULL) / 9999(<, PARTIAL).\n\n---\n\n### 주문 상태 전이 (입력 상태 + 사건 → 결과 상태)\n규칙: 환불 적용 후 누적취소액이 주문금액에 도달하면 REFUNDED, 미도달이면 PARTIALLY_REFUNDED.\n\n| 환불 전 상태 | 사건 (누적취소액 vs 주문금액) | 결과 상태 |\n|---|---|---|\n| PAID | 누적 == 주문금액 | REFUNDED |\n| PAID | 누적 < 주문금액 | PARTIALLY_REFUNDED |\n| PARTIALLY_REFUNDED | 누적 == 주문금액 | REFUNDED |\n| PARTIALLY_REFUNDED | 누적 < 주문금액 | PARTIALLY_REFUNDED |\n\n검산: 각 시작 상태(PAID / PARTIALLY_REFUNDED)에서 도달==·미도달< 경계 짝으로 REFUNDED↔PARTIALLY_REFUNDED 분기.\n\n---\n\n### 환불(Refund) 상태 전이 (입력 상태 + 사건 → 결과 상태)\n규칙: REQUESTED에서 결제취소 결과에 따라 SUCCEEDED / FAILED / TIMED_OUT으로 전이한다.\n\n| 입력 상태 | 사건 | 결과 상태 |\n|---|---|---|\n| REQUESTED | 결제취소 성공 | SUCCEEDED |\n| REQUESTED | 명확한 거부(잔액 부족 등) | FAILED |\n| REQUESTED | 결과 불확실(네트워크 오류 등) | TIMED_OUT |\n\n검산: 동일 입력 상태 REQUESTED에서 세 사건이 세 결과로 갈라짐 — 성공/명확거부/불확실 삼분기.\n\n---\n\n### 환불 가능 여부 (사전조건 판정)\n규칙: 주문 상태가 PAID 또는 PARTIALLY_REFUNDED일 때만 환불 가능, 그 외는 불가(예외).\n\n| 주문 상태 | 판정 |\n|---|---|\n| PAID | 가능 |\n| PARTIALLY_REFUNDED | 가능 |\n| REFUNDED | 불가(예외) |\n| PENDING | 불가(예외) |\n| FAILED | 불가(예외) |\n\n검산: 허용 집합 {PAID, PARTIALLY_REFUNDED}의 두 원소와 그 밖 3개 상태를 대비 — 경계는 상태 집합 소속 여부.\n\n---\n\n### 불변식 — 환불가능금액 상한\n불변식: ∀(주문금액 a, 이미 환불된 금액 c, 이번 환불금액 r). c + r ≤ a  (즉 r ≤ 환불가능금액 = a − c). 어느 정책(MANUAL·무료·PRORATION)이 발동해도 성립하며, r > a − c 인 요청은 오류로 배제되어 상태에 반영되지 않는다.\n\n| a | c | r | c+r | 어느 경계 |\n|---|---|---|---|---|\n| 10000 | 0 | 10000 | 10000 | 상한이 등호로 만나는 tight witness (전액 → REFUNDED/FULL) |\n| 10000 | 3000 | 7000 | 10000 | 부분환불 후 잔액 전액도달, 상한 등호 witness |\n\n검산: 두 witness 모두 c+r == a == 10000, 곧 r == a − c 로 상한이 등호로 팽팽하다. 초과 요청(r > a − c)은 오류이므로 불변식 c + r ≤ a 는 모든 유효 상태에서 유지된다.\n\n---\n\n### 불변식 — 환불금액 하한\n불변식: ∀ 확정 환불금액 r. r ≥ 0 이며, MANUAL 경로로 확정된 r은 r > 0 (지정금액 ≤ 0 은 오류로 배제).\n\n| 경로 | r | 어느 경계 |\n|---|---|---|\n| PRORATION 잔여일수 0 | 0 | 비음수 하한이 등호로 만나는 witness (r == 0) |\n| MANUAL 최소 지정 | 1 | 양수 하한 tight witness (0 초과 최소 정수) |\n\n검산: PRORATION은 r=0 을 허용해 하한 등호(r≥0)를 등호로 만족시키고, MANUAL은 r=1 로 자기 경로의 강한 하한(r>0)을 tight하게 만족시킨다 — MANUAL 경로에서 0 은 오류로 배제되므로 두 하한은 충돌하지 않는다.\n",
  "files": [
    {
      "path": "refund.rules.md",
      "content": "# 환불 정책 도메인 규칙 예시표\n\n> boundary feature가 담지 않는 \"규칙이 구체적으로 어떤 값을 내는가\"를 고정한다.\n> 모든 기대 출력값은 각 규칙의 산식에서 재계산으로 검증 가능하다. 클래스·메서드·시그니처는 정하지 않는다.\n\n**공통 정의**\n- 환불가능금액 = 주문금액 − 이미 환불된 금액. 어떤 환불도 이를 초과할 수 없다.\n- 일수는 UTC 날짜 기준(시/분/초 제거), 금액은 소수점 floor 절사.\n\n---\n\n### PRORATION 일할 환불금액\n규칙: 잔여 일수에 비례해 환불하되, 잔여==총일수면 전액, 잔여==0이면 0원, 총일수<=0이면 오류.\n산식: 일할단가 = floor(결제금액 / 총일수); 환불금액 = 일할단가 × 잔여일수\n\n| 결제금액 | 총일수 | 잔여일수 | 환불금액 |\n|---|---|---|---|\n| 30000 | 30 | 30 | 30000 |\n| 30000 | 30 | 29 | 29000 |\n| 30000 | 30 | 1 | 1000 |\n| 30000 | 30 | 0 | 0 |\n| 10000 | 30 | 7 | 2331 |\n| 10000 | 30 | 8 | 2664 |\n| 10000 | 0 | 5 | 오류 |\n\n검산: floor(10000/30)=333; 333×7=2331, 333×8=2664 (절사 경계 안/밖 짝). floor(30000/30)=1000; 1000×30=30000(전액 경계 안), 1000×29=29000(경계 밖), 1000×0=0(0원 경계 안).\n\n---\n\n### MANUAL 수동 지정\n규칙: 지정금액을 환불금액으로 하되, 환불가능금액을 초과하거나 0 이하이면 오류.\n산식: 환불금액 = 지정금액 (조건: 0 < 지정금액 ≤ 환불가능금액)\n\n| 지정금액 | 환불가능금액 | 환불금액 |\n|---|---|---|\n| 5000 | 10000 | 5000 |\n| 10000 | 10000 | 10000 |\n| 10001 | 10000 | 오류 |\n| 1 | 10000 | 1 |\n| 0 | 10000 | 오류 |\n\n검산: 상한 경계 짝 — 10000(=상한, 허용) / 10001(>상한, 오류). 하한 경계 짝 — 1(>0, 허용) / 0(≤0, 오류).\n\n---\n\n### 7일 이하 무료 (청약철회)\n규칙: MANUAL 지정이 없을 때, 결제일로부터 경과일이 7 이하이면 전액 환불, 8 이상이면 PRORATION 적용.\n산식: 경과일 ≤ 7 → 환불금액 = 결제금액; 경과일 ≥ 8 → PRORATION 산식 위임\n\n| 경과일 | 결제금액 | 환불금액 |\n|---|---|---|\n| 0 | 30000 | 30000 |\n| 7 | 30000 | 30000 |\n| 8 | 30000 | PRORATION 위임 |\n\n검산: 무료 경계 짝 — 7일(≤7, 전액=결제금액 30000) / 8일(≥8, PRORATION으로 위임).\n\n---\n\n### 정책 우선순위 (판정 규칙)\n규칙: MANUAL > 7일 이하 무료 > PRORATION. 상위 규칙이 발동하면 하위 규칙은 판정하지 않는다.\n산식: 판정 — MANUAL 지정 있으면 MANUAL, 없고 경과일≤7이면 무료(전액), 그 외 PRORATION\n\n| MANUAL 지정 | 경과일 | 적용 정책 |\n|---|---|---|\n| 있음 | 3 | MANUAL |\n| 있음 | 30 | MANUAL |\n| 없음 | 7 | 무료(전액) |\n| 없음 | 8 | PRORATION |\n\n검산: MANUAL이 경과일 3(무료 구간)과 30(PRORATION 구간) 양쪽에서 우선함을 보이는 짝 — MANUAL이 두 하위 규칙 모두를 가림. MANUAL 없을 때 경과일 7/8 짝으로 무료↔PRORATION 경계 확인.\n\n---\n\n### 환불 유형 결정 (판정 규칙)\n규칙: 확정된 환불금액이 환불가능금액과 같으면 FULL, 작으면 PARTIAL.\n산식: 판정 — 환불금액 == 환불가능금액 → FULL; 환불금액 < 환불가능금액 → PARTIAL\n\n| 환불금액 | 환불가능금액 | 유형 |\n|---|---|---|\n| 10000 | 10000 | FULL |\n| 9999 | 10000 | PARTIAL |\n\n검산: 등호 경계 짝 — 10000(==, FULL) / 9999(<, PARTIAL).\n\n---\n\n### 주문 상태 전이 (입력 상태 + 사건 → 결과 상태)\n규칙: 환불 적용 후 누적취소액이 주문금액에 도달하면 REFUNDED, 미도달이면 PARTIALLY_REFUNDED.\n\n| 환불 전 상태 | 사건 (누적취소액 vs 주문금액) | 결과 상태 |\n|---|---|---|\n| PAID | 누적 == 주문금액 | REFUNDED |\n| PAID | 누적 < 주문금액 | PARTIALLY_REFUNDED |\n| PARTIALLY_REFUNDED | 누적 == 주문금액 | REFUNDED |\n| PARTIALLY_REFUNDED | 누적 < 주문금액 | PARTIALLY_REFUNDED |\n\n검산: 각 시작 상태(PAID / PARTIALLY_REFUNDED)에서 도달==·미도달< 경계 짝으로 REFUNDED↔PARTIALLY_REFUNDED 분기.\n\n---\n\n### 환불(Refund) 상태 전이 (입력 상태 + 사건 → 결과 상태)\n규칙: REQUESTED에서 결제취소 결과에 따라 SUCCEEDED / FAILED / TIMED_OUT으로 전이한다.\n\n| 입력 상태 | 사건 | 결과 상태 |\n|---|---|---|\n| REQUESTED | 결제취소 성공 | SUCCEEDED |\n| REQUESTED | 명확한 거부(잔액 부족 등) | FAILED |\n| REQUESTED | 결과 불확실(네트워크 오류 등) | TIMED_OUT |\n\n검산: 동일 입력 상태 REQUESTED에서 세 사건이 세 결과로 갈라짐 — 성공/명확거부/불확실 삼분기.\n\n---\n\n### 환불 가능 여부 (사전조건 판정)\n규칙: 주문 상태가 PAID 또는 PARTIALLY_REFUNDED일 때만 환불 가능, 그 외는 불가(예외).\n\n| 주문 상태 | 판정 |\n|---|---|\n| PAID | 가능 |\n| PARTIALLY_REFUNDED | 가능 |\n| REFUNDED | 불가(예외) |\n| PENDING | 불가(예외) |\n| FAILED | 불가(예외) |\n\n검산: 허용 집합 {PAID, PARTIALLY_REFUNDED}의 두 원소와 그 밖 3개 상태를 대비 — 경계는 상태 집합 소속 여부.\n\n---\n\n### 불변식 — 환불가능금액 상한\n불변식: ∀(주문금액 a, 이미 환불된 금액 c, 이번 환불금액 r). c + r ≤ a  (즉 r ≤ 환불가능금액 = a − c). 어느 정책(MANUAL·무료·PRORATION)이 발동해도 성립하며, r > a − c 인 요청은 오류로 배제되어 상태에 반영되지 않는다.\n\n| a | c | r | c+r | 어느 경계 |\n|---|---|---|---|---|\n| 10000 | 0 | 10000 | 10000 | 상한이 등호로 만나는 tight witness (전액 → REFUNDED/FULL) |\n| 10000 | 3000 | 7000 | 10000 | 부분환불 후 잔액 전액도달, 상한 등호 witness |\n\n검산: 두 witness 모두 c+r == a == 10000, 곧 r == a − c 로 상한이 등호로 팽팽하다. 초과 요청(r > a − c)은 오류이므로 불변식 c + r ≤ a 는 모든 유효 상태에서 유지된다.\n\n---\n\n### 불변식 — 환불금액 하한\n불변식: ∀ 확정 환불금액 r. r ≥ 0 이며, MANUAL 경로로 확정된 r은 r > 0 (지정금액 ≤ 0 은 오류로 배제).\n\n| 경로 | r | 어느 경계 |\n|---|---|---|\n| PRORATION 잔여일수 0 | 0 | 비음수 하한이 등호로 만나는 witness (r == 0) |\n| MANUAL 최소 지정 | 1 | 양수 하한 tight witness (0 초과 최소 정수) |\n\n검산: PRORATION은 r=0 을 허용해 하한 등호(r≥0)를 등호로 만족시키고, MANUAL은 r=1 로 자기 경로의 강한 하한(r>0)을 tight하게 만족시킨다 — MANUAL 경로에서 0 은 오류로 배제되므로 두 하한은 충돌하지 않는다.\n"
    }
  ],
  "generated_at": "2026-07-21T23:12:23+09:00",
  "model": "claude-sonnet-4-6",
  "metadata": {
    "prompt_version": "gen_system:v1",
    "source_files": [
      "f1ba346d_input.json"
    ]
  }
}
