{
  "brief_hash": "57796ebc",
  "iteration": "002",
  "stage": "refine",
  "content": "// ===== FILE: ticket_service_reserve_ticket_characterization.feature =====\nFeature: TicketService reserveTicket(long userId, long ticketId, String paymentInfo) 리팩토링 전 특성화\n  리팩토링 전 TicketService.reserveTicket의 현재 관찰 가능한 동작을 quirk까지 그대로 고정한다.\n\n  Background:\n    Given TicketRepository, UserRepository, PaymentApi는 격리된 협력자이다\n    And TicketService는 위 3개 협력자로 생성되어 있다\n\n  Scenario Outline: 유저가 존재하고 티켓이 미예약이며 결제가 성공하면 티켓을 예약하고 저장한 뒤 true를 반환한다\n    Given UserRepository가 userId <userId>에 대해 유저를 반환한다\n    And TicketRepository가 ticketId <ticketId>에 대해 가격 <price>의 미예약 티켓을 반환한다\n    And PaymentApi가 paymentInfo \"<paymentInfo>\"와 금액 <price> 결제를 성공으로 응답한다\n    When TicketService.reserveTicket(<userId>, <ticketId>, \"<paymentInfo>\")를 호출한다\n    Then 반환값은 true이다\n    And 티켓의 예약 상태는 true이다\n    And 티켓의 userId는 <userId>이다\n    And PaymentApi.charge는 paymentInfo \"<paymentInfo>\"와 금액 <price>로 1번 호출된다\n    And TicketRepository.save는 해당 티켓으로 1번 호출된다\n\n    Examples:\n      | userId | ticketId | price | paymentInfo |\n      | 1      | 10       | 5000  | card-A      |\n      | 2      | 20       | 7000  | card-B      |\n\n  Scenario: 결제는 티켓 저장보다 먼저 일어난다\n    Given UserRepository가 userId 1에 대해 유저를 반환한다\n    And TicketRepository가 ticketId 10에 대해 가격 5000의 미예약 티켓을 반환한다\n    And PaymentApi가 paymentInfo \"card-A\"와 금액 5000 결제를 성공으로 응답한다\n    When TicketService.reserveTicket(1, 10, \"card-A\")를 호출한다\n    Then PaymentApi.charge 호출은 TicketRepository.save 호출보다 먼저 기록된다\n    And 반환값은 true이다\n\n  Scenario Outline: 유저가 없으면 UserNotFoundException을 던지고 이후 협력자를 호출하지 않는다\n    Given UserRepository가 userId <userId>에 대해 null을 반환한다\n    When TicketService.reserveTicket(<userId>, <ticketId>, \"<paymentInfo>\")를 호출한다\n    Then UserNotFoundException이 발생한다\n    And TicketRepository.findById는 호출되지 않는다\n    And PaymentApi.charge는 호출되지 않는다\n    And TicketRepository.save는 호출되지 않는다\n\n    Examples:\n      | userId | ticketId | paymentInfo |\n      | 1      | 10       | card-A      |\n      | 2      | 20       | card-B      |\n\n  Scenario Outline: 이미 예약된 티켓이면 TicketAlreadyReservedException을 던지고 결제와 저장을 하지 않는다\n    Given UserRepository가 userId <userId>에 대해 유저를 반환한다\n    And TicketRepository가 ticketId <ticketId>에 대해 가격 <price>의 이미 예약된 티켓을 반환한다\n    When TicketService.reserveTicket(<userId>, <ticketId>, \"<paymentInfo>\")를 호출한다\n    Then TicketAlreadyReservedException이 발생한다\n    And PaymentApi.charge는 호출되지 않는다\n    And TicketRepository.save는 호출되지 않는다\n\n    Examples:\n      | userId | ticketId | price | paymentInfo |\n      | 1      | 10       | 5000  | card-A      |\n      | 2      | 20       | 7000  | card-B      |\n\n  Scenario Outline: 결제가 실패하면 PaymentFailedException을 던지고 티켓 상태와 저장은 바뀌지 않는다\n    Given UserRepository가 userId <userId>에 대해 유저를 반환한다\n    And TicketRepository가 ticketId <ticketId>에 대해 가격 <price>의 미예약 티켓을 반환한다\n    And 해당 티켓의 사전 userId는 <existingUserId>이다\n    And PaymentApi가 paymentInfo \"<paymentInfo>\"와 금액 <price> 결제를 실패로 응답한다\n    When TicketService.reserveTicket(<userId>, <ticketId>, \"<paymentInfo>\")를 호출한다\n    Then PaymentFailedException이 발생한다\n    And 티켓의 예약 상태는 false이다\n    And 티켓의 userId는 <existingUserId>이다\n    And PaymentApi.charge는 paymentInfo \"<paymentInfo>\"와 금액 <price>로 1번 호출된다\n    And TicketRepository.save는 호출되지 않는다\n\n    Examples:\n      | userId | ticketId | price | existingUserId | paymentInfo |\n      | 1      | 10       | 5000  | 900            | card-A      |\n      | 2      | 20       | 7000  | 901            | card-B      |\n\n  Scenario Outline: QUIRK null 티켓이면 도메인 예외가 아니라 NullPointerException이 발생한다\n    Given UserRepository가 userId <userId>에 대해 유저를 반환한다\n    And TicketRepository가 ticketId <ticketId>에 대해 null을 반환한다\n    When TicketService.reserveTicket(<userId>, <ticketId>, \"<paymentInfo>\")를 호출한다\n    Then NullPointerException이 발생한다\n    And PaymentApi.charge는 호출되지 않는다\n    And TicketRepository.save는 호출되지 않는다\n\n    Examples:\n      | userId | ticketId | paymentInfo |\n      | 1      | 10       | card-A      |\n      | 2      | 20       | card-B      |\n\n  Scenario: QUIRK 결제 성공 뒤 저장이 실패하면 저장 예외가 그대로 전파되고 티켓은 이미 예약 상태로 바뀌어 있다\n    Given UserRepository가 userId 1에 대해 유저를 반환한다\n    And TicketRepository가 ticketId 10에 대해 가격 5000의 미예약 티켓을 반환한다\n    And PaymentApi가 paymentInfo \"card-A\"와 금액 5000 결제를 성공으로 응답한다\n    And TicketRepository.save가 RuntimeException 인스턴스 storageFailure를 던지도록 되어 있다\n    When TicketService.reserveTicket(1, 10, \"card-A\")를 호출한다\n    Then storageFailure와 같은 RuntimeException 인스턴스가 발생한다\n    And PaymentApi.charge는 paymentInfo \"card-A\"와 금액 5000로 1번 호출된다\n    And 티켓의 예약 상태는 true이다\n    And 티켓의 userId는 1이다\n    And TicketRepository.save는 예약 상태 true이고 userId 1인 해당 티켓으로 1번 호출된다\n    And PaymentApi에는 charge 외 추가 상호작용이 없다\n",
  "files": [
    {
      "path": "ticket_service_reserve_ticket_characterization.feature",
      "content": "Feature: TicketService reserveTicket(long userId, long ticketId, String paymentInfo) 리팩토링 전 특성화\n  리팩토링 전 TicketService.reserveTicket의 현재 관찰 가능한 동작을 quirk까지 그대로 고정한다.\n\n  Background:\n    Given TicketRepository, UserRepository, PaymentApi는 격리된 협력자이다\n    And TicketService는 위 3개 협력자로 생성되어 있다\n\n  Scenario Outline: 유저가 존재하고 티켓이 미예약이며 결제가 성공하면 티켓을 예약하고 저장한 뒤 true를 반환한다\n    Given UserRepository가 userId <userId>에 대해 유저를 반환한다\n    And TicketRepository가 ticketId <ticketId>에 대해 가격 <price>의 미예약 티켓을 반환한다\n    And PaymentApi가 paymentInfo \"<paymentInfo>\"와 금액 <price> 결제를 성공으로 응답한다\n    When TicketService.reserveTicket(<userId>, <ticketId>, \"<paymentInfo>\")를 호출한다\n    Then 반환값은 true이다\n    And 티켓의 예약 상태는 true이다\n    And 티켓의 userId는 <userId>이다\n    And PaymentApi.charge는 paymentInfo \"<paymentInfo>\"와 금액 <price>로 1번 호출된다\n    And TicketRepository.save는 해당 티켓으로 1번 호출된다\n\n    Examples:\n      | userId | ticketId | price | paymentInfo |\n      | 1      | 10       | 5000  | card-A      |\n      | 2      | 20       | 7000  | card-B      |\n\n  Scenario: 결제는 티켓 저장보다 먼저 일어난다\n    Given UserRepository가 userId 1에 대해 유저를 반환한다\n    And TicketRepository가 ticketId 10에 대해 가격 5000의 미예약 티켓을 반환한다\n    And PaymentApi가 paymentInfo \"card-A\"와 금액 5000 결제를 성공으로 응답한다\n    When TicketService.reserveTicket(1, 10, \"card-A\")를 호출한다\n    Then PaymentApi.charge 호출은 TicketRepository.save 호출보다 먼저 기록된다\n    And 반환값은 true이다\n\n  Scenario Outline: 유저가 없으면 UserNotFoundException을 던지고 이후 협력자를 호출하지 않는다\n    Given UserRepository가 userId <userId>에 대해 null을 반환한다\n    When TicketService.reserveTicket(<userId>, <ticketId>, \"<paymentInfo>\")를 호출한다\n    Then UserNotFoundException이 발생한다\n    And TicketRepository.findById는 호출되지 않는다\n    And PaymentApi.charge는 호출되지 않는다\n    And TicketRepository.save는 호출되지 않는다\n\n    Examples:\n      | userId | ticketId | paymentInfo |\n      | 1      | 10       | card-A      |\n      | 2      | 20       | card-B      |\n\n  Scenario Outline: 이미 예약된 티켓이면 TicketAlreadyReservedException을 던지고 결제와 저장을 하지 않는다\n    Given UserRepository가 userId <userId>에 대해 유저를 반환한다\n    And TicketRepository가 ticketId <ticketId>에 대해 가격 <price>의 이미 예약된 티켓을 반환한다\n    When TicketService.reserveTicket(<userId>, <ticketId>, \"<paymentInfo>\")를 호출한다\n    Then TicketAlreadyReservedException이 발생한다\n    And PaymentApi.charge는 호출되지 않는다\n    And TicketRepository.save는 호출되지 않는다\n\n    Examples:\n      | userId | ticketId | price | paymentInfo |\n      | 1      | 10       | 5000  | card-A      |\n      | 2      | 20       | 7000  | card-B      |\n\n  Scenario Outline: 결제가 실패하면 PaymentFailedException을 던지고 티켓 상태와 저장은 바뀌지 않는다\n    Given UserRepository가 userId <userId>에 대해 유저를 반환한다\n    And TicketRepository가 ticketId <ticketId>에 대해 가격 <price>의 미예약 티켓을 반환한다\n    And 해당 티켓의 사전 userId는 <existingUserId>이다\n    And PaymentApi가 paymentInfo \"<paymentInfo>\"와 금액 <price> 결제를 실패로 응답한다\n    When TicketService.reserveTicket(<userId>, <ticketId>, \"<paymentInfo>\")를 호출한다\n    Then PaymentFailedException이 발생한다\n    And 티켓의 예약 상태는 false이다\n    And 티켓의 userId는 <existingUserId>이다\n    And PaymentApi.charge는 paymentInfo \"<paymentInfo>\"와 금액 <price>로 1번 호출된다\n    And TicketRepository.save는 호출되지 않는다\n\n    Examples:\n      | userId | ticketId | price | existingUserId | paymentInfo |\n      | 1      | 10       | 5000  | 900            | card-A      |\n      | 2      | 20       | 7000  | 901            | card-B      |\n\n  Scenario Outline: QUIRK null 티켓이면 도메인 예외가 아니라 NullPointerException이 발생한다\n    Given UserRepository가 userId <userId>에 대해 유저를 반환한다\n    And TicketRepository가 ticketId <ticketId>에 대해 null을 반환한다\n    When TicketService.reserveTicket(<userId>, <ticketId>, \"<paymentInfo>\")를 호출한다\n    Then NullPointerException이 발생한다\n    And PaymentApi.charge는 호출되지 않는다\n    And TicketRepository.save는 호출되지 않는다\n\n    Examples:\n      | userId | ticketId | paymentInfo |\n      | 1      | 10       | card-A      |\n      | 2      | 20       | card-B      |\n\n  Scenario: QUIRK 결제 성공 뒤 저장이 실패하면 저장 예외가 그대로 전파되고 티켓은 이미 예약 상태로 바뀌어 있다\n    Given UserRepository가 userId 1에 대해 유저를 반환한다\n    And TicketRepository가 ticketId 10에 대해 가격 5000의 미예약 티켓을 반환한다\n    And PaymentApi가 paymentInfo \"card-A\"와 금액 5000 결제를 성공으로 응답한다\n    And TicketRepository.save가 RuntimeException 인스턴스 storageFailure를 던지도록 되어 있다\n    When TicketService.reserveTicket(1, 10, \"card-A\")를 호출한다\n    Then storageFailure와 같은 RuntimeException 인스턴스가 발생한다\n    And PaymentApi.charge는 paymentInfo \"card-A\"와 금액 5000로 1번 호출된다\n    And 티켓의 예약 상태는 true이다\n    And 티켓의 userId는 1이다\n    And TicketRepository.save는 예약 상태 true이고 userId 1인 해당 티켓으로 1번 호출된다\n    And PaymentApi에는 charge 외 추가 상호작용이 없다\n"
    }
  ],
  "generated_at": "2026-07-13T15:52:59+09:00",
  "model": "gpt-5.5",
  "metadata": {
    "prompt_version": "refine_system:v1",
    "source_files": [
      "57796ebc_input.json"
    ],
    "token_usage": {
      "input_tokens": 30405,
      "cached_input_tokens": 17792,
      "output_tokens": 2076,
      "reasoning_output_tokens": 516
    }
  }
}
