{
  "brief_hash": "f1ba346d",
  "iteration": "003",
  "stage": "refine",
  "content": "// ===== FILE: refund.feature =====\nFeature: 환불 요청 처리\n  환불 요청 유스케이스는 주문의 환불 가능 여부와 결제 취소 결과에 따라 환불 결과, 주문 상태, 환불 상태를 결정한다.\n\n  Background:\n    Given 결제 취소는 요청된 금액에 대해 성공한다고 알려져 있다\n\n  Scenario Outline: 결제 완료 주문에 자동 환불을 요청하면 정책에 따라 환불 금액과 유형이 확정된다\n    Given 주문 금액이 <주문금액>원인 결제 완료 주문이 있다\n    And 이미 환불된 금액은 0원이다\n    And 자동 환불 조건은 <환불조건>이다\n    When 환불을 요청하면\n    Then 환불 요청은 성공한다\n    And 환불 금액은 <환불금액>원이다\n    And 환불 유형은 <환불유형>이다\n    And 주문 상태는 <주문상태>이다\n    And 환불 상태는 성공이다\n\n    Examples:\n      | 주문금액 | 환불조건                    | 환불금액 | 환불유형 | 주문상태     |\n      | 30000    | 무료 환불 기간 안           | 30000    | 전액 환불 | 전액 환불됨  |\n      | 30000    | 무료 환불 기간 다음 날      | 15000    | 부분 환불 | 부분 환불됨  |\n      | 10000    | 절사 금액이 발생하는 기간   | 2331     | 부분 환불 | 부분 환불됨  |\n\n  Scenario: 자동 산출된 환불 금액이 0원이면 환불은 성공하지만 주문 상태는 유지된다\n    Given 주문 금액이 30000원인 결제 완료 주문이 있다\n    And 이미 환불된 금액은 0원이다\n    And 자동 환불 조건은 환불 가능한 미사용 기간이 없음이다\n    When 환불을 요청하면\n    Then 환불 요청은 성공한다\n    And 환불 금액은 0원이다\n    And 환불 유형은 부분 환불이다\n    And 주문 상태는 결제 완료이다\n    And 환불 상태는 성공이다\n\n  Scenario Outline: 수동 환불을 요청하면 수동 지정 금액이 다른 자동 환불 조건보다 우선한다\n    Given 주문 금액이 30000원인 <주문상태> 주문이 있다\n    And 이미 환불된 금액은 <이미환불된금액>원이다\n    And 자동 환불 조건은 무료 환불 기간 안이다\n    And 관리자가 지정한 환불 금액은 <지정금액>원이다\n    When 환불을 요청하면\n    Then 환불 요청은 성공한다\n    And 환불 금액은 <환불금액>원이다\n    And 환불 유형은 <환불유형>이다\n    And 주문 상태는 <결과주문상태>이다\n    And 환불 상태는 성공이다\n\n    Examples:\n      | 주문상태    | 이미환불된금액 | 지정금액 | 환불금액 | 환불유형 | 결과주문상태 |\n      | 결제 완료   | 0              | 5000     | 5000     | 부분 환불 | 부분 환불됨  |\n      | 부분 환불됨 | 10000          | 20000    | 20000    | 전액 환불 | 전액 환불됨  |\n\n  Scenario Outline: 환불 가능 금액을 벗어나는 환불을 요청하면 거절된다\n    Given 주문 금액이 <주문금액>원인 <주문상태> 주문이 있다\n    And 이미 환불된 금액은 <이미환불된금액>원이다\n    And 자동 환불 조건은 <환불조건>이다\n    And 관리자가 지정한 환불 금액은 <지정금액>이다\n    When 환불을 요청하면\n    Then 환불 요청은 거절된다\n    And 거절 사유는 환불 가능 금액을 초과함이다\n    And 주문 상태는 <주문상태>이다\n    And 환불 상태는 생성되지 않는다\n\n    Examples:\n      | 주문금액 | 이미환불된금액 | 주문상태    | 환불조건               | 지정금액 |\n      | 30000    | 10000          | 부분 환불됨 | 무료 환불 기간 안      | 없음     |\n      | 30000    | 10000          | 부분 환불됨 | 무료 환불 기간 다음 날 | 20001원  |\n\n  Scenario Outline: 유효하지 않은 수동 환불 금액으로 환불을 요청하면 거절된다\n    Given 주문 금액이 30000원인 결제 완료 주문이 있다\n    And 이미 환불된 금액은 0원이다\n    And 자동 환불 조건은 무료 환불 기간 안이다\n    And 관리자가 지정한 환불 금액은 <지정금액>원이다\n    When 환불을 요청하면\n    Then 환불 요청은 거절된다\n    And 거절 사유는 수동 환불 금액이 0원 이하임이다\n    And 주문 상태는 결제 완료이다\n    And 환불 상태는 생성되지 않는다\n\n    Examples:\n      | 지정금액 |\n      | 0        |\n      | -1       |\n\n  Scenario Outline: 환불할 수 없는 주문에 환불을 요청하면 거절된다\n    Given 주문 금액이 30000원인 <주문상태> 주문이 있다\n    And 이미 환불된 금액은 <이미환불된금액>원이다\n    And 자동 환불 조건은 무료 환불 기간 다음 날이다\n    And 관리자가 지정한 환불 금액은 없음이다\n    When 환불을 요청하면\n    Then 환불 요청은 거절된다\n    And 거절 사유는 <거절사유>이다\n    And 주문 상태는 <주문상태>이다\n    And 환불 상태는 생성되지 않는다\n\n    Examples:\n      | 주문상태     | 이미환불된금액 | 거절사유             |\n      | 전액 환불됨  | 30000          | 이미 전액 환불됨     |\n      | 결제 대기    | 0              | 결제가 완료되지 않음 |\n      | 결제 실패    | 0              | 결제가 완료되지 않음 |\n\n  Scenario Outline: 부분 환불된 주문에 추가 환불을 요청하면 남은 환불 가능 금액 기준으로 주문 상태가 결정된다\n    Given 주문 금액이 30000원인 부분 환불됨 주문이 있다\n    And 이미 환불된 금액은 10000원이다\n    And 자동 환불 조건은 무료 환불 기간 다음 날이다\n    And 관리자가 지정한 환불 금액은 <지정금액>원이다\n    When 환불을 요청하면\n    Then 환불 요청은 성공한다\n    And 환불 금액은 <환불금액>원이다\n    And 환불 유형은 <환불유형>이다\n    And 주문 상태는 <주문상태>이다\n    And 환불 상태는 성공이다\n\n    Examples:\n      | 지정금액 | 환불금액 | 환불유형 | 주문상태     |\n      | 19999    | 19999    | 부분 환불 | 부분 환불됨  |\n      | 20000    | 20000    | 전액 환불 | 전액 환불됨  |\n\n  Scenario Outline: 결제 취소가 성공하지 못하면 환불 결과만 실패 상태로 남고 주문은 환불 적용되지 않는다\n    Given 주문 금액이 30000원인 결제 완료 주문이 있다\n    And 이미 환불된 금액은 0원이다\n    And 자동 환불 조건은 무료 환불 기간 다음 날이다\n    And 관리자가 지정한 환불 금액은 없음이다\n    And 결제 취소 결과는 <결제취소결과>이다\n    When 환불을 요청하면\n    Then 환불 요청 결과는 <환불요청결과>이다\n    And 환불 금액은 15000원이다\n    And 환불 상태는 <환불상태>이다\n    And 주문 상태는 결제 완료이다\n\n    Examples:\n      | 결제취소결과 | 환불요청결과 | 환불상태 |\n      | 명확한 거부  | 실패         | 실패     |\n      | 결과 불확실  | 타임아웃     | 타임아웃 |",
  "files": [
    {
      "path": "refund.feature",
      "content": "Feature: 환불 요청 처리\n  환불 요청 유스케이스는 주문의 환불 가능 여부와 결제 취소 결과에 따라 환불 결과, 주문 상태, 환불 상태를 결정한다.\n\n  Background:\n    Given 결제 취소는 요청된 금액에 대해 성공한다고 알려져 있다\n\n  Scenario Outline: 결제 완료 주문에 자동 환불을 요청하면 정책에 따라 환불 금액과 유형이 확정된다\n    Given 주문 금액이 <주문금액>원인 결제 완료 주문이 있다\n    And 이미 환불된 금액은 0원이다\n    And 자동 환불 조건은 <환불조건>이다\n    When 환불을 요청하면\n    Then 환불 요청은 성공한다\n    And 환불 금액은 <환불금액>원이다\n    And 환불 유형은 <환불유형>이다\n    And 주문 상태는 <주문상태>이다\n    And 환불 상태는 성공이다\n\n    Examples:\n      | 주문금액 | 환불조건                    | 환불금액 | 환불유형 | 주문상태     |\n      | 30000    | 무료 환불 기간 안           | 30000    | 전액 환불 | 전액 환불됨  |\n      | 30000    | 무료 환불 기간 다음 날      | 15000    | 부분 환불 | 부분 환불됨  |\n      | 10000    | 절사 금액이 발생하는 기간   | 2331     | 부분 환불 | 부분 환불됨  |\n\n  Scenario: 자동 산출된 환불 금액이 0원이면 환불은 성공하지만 주문 상태는 유지된다\n    Given 주문 금액이 30000원인 결제 완료 주문이 있다\n    And 이미 환불된 금액은 0원이다\n    And 자동 환불 조건은 환불 가능한 미사용 기간이 없음이다\n    When 환불을 요청하면\n    Then 환불 요청은 성공한다\n    And 환불 금액은 0원이다\n    And 환불 유형은 부분 환불이다\n    And 주문 상태는 결제 완료이다\n    And 환불 상태는 성공이다\n\n  Scenario Outline: 수동 환불을 요청하면 수동 지정 금액이 다른 자동 환불 조건보다 우선한다\n    Given 주문 금액이 30000원인 <주문상태> 주문이 있다\n    And 이미 환불된 금액은 <이미환불된금액>원이다\n    And 자동 환불 조건은 무료 환불 기간 안이다\n    And 관리자가 지정한 환불 금액은 <지정금액>원이다\n    When 환불을 요청하면\n    Then 환불 요청은 성공한다\n    And 환불 금액은 <환불금액>원이다\n    And 환불 유형은 <환불유형>이다\n    And 주문 상태는 <결과주문상태>이다\n    And 환불 상태는 성공이다\n\n    Examples:\n      | 주문상태    | 이미환불된금액 | 지정금액 | 환불금액 | 환불유형 | 결과주문상태 |\n      | 결제 완료   | 0              | 5000     | 5000     | 부분 환불 | 부분 환불됨  |\n      | 부분 환불됨 | 10000          | 20000    | 20000    | 전액 환불 | 전액 환불됨  |\n\n  Scenario Outline: 환불 가능 금액을 벗어나는 환불을 요청하면 거절된다\n    Given 주문 금액이 <주문금액>원인 <주문상태> 주문이 있다\n    And 이미 환불된 금액은 <이미환불된금액>원이다\n    And 자동 환불 조건은 <환불조건>이다\n    And 관리자가 지정한 환불 금액은 <지정금액>이다\n    When 환불을 요청하면\n    Then 환불 요청은 거절된다\n    And 거절 사유는 환불 가능 금액을 초과함이다\n    And 주문 상태는 <주문상태>이다\n    And 환불 상태는 생성되지 않는다\n\n    Examples:\n      | 주문금액 | 이미환불된금액 | 주문상태    | 환불조건               | 지정금액 |\n      | 30000    | 10000          | 부분 환불됨 | 무료 환불 기간 안      | 없음     |\n      | 30000    | 10000          | 부분 환불됨 | 무료 환불 기간 다음 날 | 20001원  |\n\n  Scenario Outline: 유효하지 않은 수동 환불 금액으로 환불을 요청하면 거절된다\n    Given 주문 금액이 30000원인 결제 완료 주문이 있다\n    And 이미 환불된 금액은 0원이다\n    And 자동 환불 조건은 무료 환불 기간 안이다\n    And 관리자가 지정한 환불 금액은 <지정금액>원이다\n    When 환불을 요청하면\n    Then 환불 요청은 거절된다\n    And 거절 사유는 수동 환불 금액이 0원 이하임이다\n    And 주문 상태는 결제 완료이다\n    And 환불 상태는 생성되지 않는다\n\n    Examples:\n      | 지정금액 |\n      | 0        |\n      | -1       |\n\n  Scenario Outline: 환불할 수 없는 주문에 환불을 요청하면 거절된다\n    Given 주문 금액이 30000원인 <주문상태> 주문이 있다\n    And 이미 환불된 금액은 <이미환불된금액>원이다\n    And 자동 환불 조건은 무료 환불 기간 다음 날이다\n    And 관리자가 지정한 환불 금액은 없음이다\n    When 환불을 요청하면\n    Then 환불 요청은 거절된다\n    And 거절 사유는 <거절사유>이다\n    And 주문 상태는 <주문상태>이다\n    And 환불 상태는 생성되지 않는다\n\n    Examples:\n      | 주문상태     | 이미환불된금액 | 거절사유             |\n      | 전액 환불됨  | 30000          | 이미 전액 환불됨     |\n      | 결제 대기    | 0              | 결제가 완료되지 않음 |\n      | 결제 실패    | 0              | 결제가 완료되지 않음 |\n\n  Scenario Outline: 부분 환불된 주문에 추가 환불을 요청하면 남은 환불 가능 금액 기준으로 주문 상태가 결정된다\n    Given 주문 금액이 30000원인 부분 환불됨 주문이 있다\n    And 이미 환불된 금액은 10000원이다\n    And 자동 환불 조건은 무료 환불 기간 다음 날이다\n    And 관리자가 지정한 환불 금액은 <지정금액>원이다\n    When 환불을 요청하면\n    Then 환불 요청은 성공한다\n    And 환불 금액은 <환불금액>원이다\n    And 환불 유형은 <환불유형>이다\n    And 주문 상태는 <주문상태>이다\n    And 환불 상태는 성공이다\n\n    Examples:\n      | 지정금액 | 환불금액 | 환불유형 | 주문상태     |\n      | 19999    | 19999    | 부분 환불 | 부분 환불됨  |\n      | 20000    | 20000    | 전액 환불 | 전액 환불됨  |\n\n  Scenario Outline: 결제 취소가 성공하지 못하면 환불 결과만 실패 상태로 남고 주문은 환불 적용되지 않는다\n    Given 주문 금액이 30000원인 결제 완료 주문이 있다\n    And 이미 환불된 금액은 0원이다\n    And 자동 환불 조건은 무료 환불 기간 다음 날이다\n    And 관리자가 지정한 환불 금액은 없음이다\n    And 결제 취소 결과는 <결제취소결과>이다\n    When 환불을 요청하면\n    Then 환불 요청 결과는 <환불요청결과>이다\n    And 환불 금액은 15000원이다\n    And 환불 상태는 <환불상태>이다\n    And 주문 상태는 결제 완료이다\n\n    Examples:\n      | 결제취소결과 | 환불요청결과 | 환불상태 |\n      | 명확한 거부  | 실패         | 실패     |\n      | 결과 불확실  | 타임아웃     | 타임아웃 |"
    }
  ],
  "generated_at": "2026-07-21T17:27:51+09:00",
  "model": "gpt-5.5",
  "metadata": {
    "prompt_version": "refine_system:v1",
    "source_files": [
      "f1ba346d_input.json"
    ],
    "token_usage": {
      "input_tokens": 34117,
      "cached_input_tokens": 18816,
      "output_tokens": 2445,
      "reasoning_output_tokens": 516
    }
  }
}
